titles,links,content,time,media
副 手 辯 論 　 蘇 嘉 全 妻 子 不 到 場,https://tw.news.appledaily.com/politics/realtime/20111209/100162/,2012總統大選副總統候選人辯論明天登場，民進黨副總統候選人蘇嘉全近日來身陷妻子洪恆珠看猛男秀的風波中，據綠營人士指出，...,2011-12-09,Apple Daily
綠 委 ： 未 來 新 藥 量 產 　 蔡 是 愛 滋 病 天 使,https://tw.news.appledaily.com/politics/realtime/20111209/100161/,針對「宇昌」爭議，民進黨立院黨團今天上午召開記者會反擊，黨團幹事長蔡煌瑯說，本來很尊敬劉憶如，一直認為她有學者風骨，但明...,2011-12-09,Apple Daily
藍 委 疑 國 庫 通 家 庫 　 籲 蔡 交 代 「 宇 昌 」 案,https://tw.news.appledaily.com/politics/realtime/20111209/100155/,國民黨立院黨團今天持續追打「宇昌生技案」，黨團副書記長潘維剛在記者會中說，民進黨總統參選人蔡英文在擔任行政院副院長時，6...,2011-12-09,Apple Daily
宋 楚 瑜 開 心 ： 當 選 省 長 也 是 3 號,https://tw.news.appledaily.com/politics/realtime/20111209/100147/,親民黨總統參選人宋楚瑜，今天上午抽到3號。他受訪說，3號很好，代表他這次參選就是要關心3中問題，另外也要強化「三生產業」...,2011-12-09,Apple Daily
小 英 拜 媽 祖 中 籤 王 　 粉 絲 ： 台 灣 第 1 女 總 統,https://tw.news.appledaily.com/politics/realtime/20111209/100140/,民進黨總統參選人蔡英文，今天進行第4天台17線活動，上午到有3百年歷史的「鹿耳門天后宮」參拜上香，廟方罕見由儀衛隊迎接，...,2011-12-09,Apple Daily
重 提 宇 昌 案 　 蔡 英 文 批 民 主 之 恥,https://tw.news.appledaily.com/politics/realtime/20111209/100119/,民進黨總統候選人蔡英文今天在台南市回應宇昌案，她抨擊國民黨重提舊案，在選舉關鍵時刻，透過特定人士，以立法院報告模式且配合...,2011-12-09,Apple Daily
宇 昌 案 爭 議 　 蔡 英 文 1 2 ： 4 5 親 說 明,https://tw.news.appledaily.com/politics/realtime/20111209/100094/,"針對宇昌案，民進黨總統參選人蔡英文決定親自出面說明。

國民黨近期質疑蔡英文在2007年行政院副院長任內，以「極機密...",2011-12-09,Apple Daily
抽 到 1 號 　 蔡 英 文 ： 早 有 預 感,https://tw.news.appledaily.com/politics/realtime/20111209/100083/,"2012總統大選號次抽籤今天上午在中選會進行，民進黨總統參選人蔡英文抽得1號，她隨後公開表示，早有預感會抽到1號。

...",2011-12-09,Apple Daily
號 次 抽 籤 　 英 嘉 1 號 　 馬 吳 2 號 　 宋 林 3 號,https://tw.news.appledaily.com/politics/realtime/20111209/100080/,"2012總統副總統大選號次抽籤今天在中選會進行，3黨參選人都未出席，派出不同代表代為抽籤。

國民黨的馬吳配由副總統...",2011-12-09,Apple Daily
蔡 英 文 投 資 宇 昌   一 周 內 解 密,https://www.appledaily.com.tw/appledaily/article/headline/20111209/33875730/,民進黨發言人陳其邁回嗆，依目前興櫃市場每股三十五元，宇昌幫政府大賺超過新台幣十億元，馬政府去年還投資一點三七億元，國民黨...,2011-12-09,Apple Daily
明 天 辯 論 誰 勝 出 （ 趙 少 康 ）,https://www.appledaily.com.tw/appledaily/article/headline/20111209/33875512/,吳敦義思慮周密、邏輯嚴緊、文采豐富、辯才無礙，又有民代及首長歷練，明日應可從容表現，惟要注意不可太過銳利，固然爭所當爭，...,2011-12-09,Apple Daily
蔡 拋 利 多   新 鮮 人 失 業   月 領 萬 元,https://www.appledaily.com.tw/appledaily/article/headline/20111209/33875736/,馬總統昨則與女性工會幹部座談時，宣布未來女性勞工若生雙胞胎以上，勞保生育給付將按比例發給。如以最高投保薪資估算，原本生雙...,2011-12-09,Apple Daily
辣 蘋 果 專 欄 ： 笨 蛋 ， 問 題 在 自 律 （ 余 艾 苔 ）,https://www.appledaily.com.tw/appledaily/article/headline/20111209/33875728/,洪恆珠十年前不會知道十年後她有可能成為副總統夫人，所以很多人會認為，對於十年前的一張光碟片無需大驚小怪。但是人的性格可以...,2011-12-09,Apple Daily
司 馬 觀 點 ： 北 京 介 入 選 舉 （ 江 春 男 ）,https://www.appledaily.com.tw/appledaily/article/headline/20111209/33875522/,中共對馬英九落選的憂心忡忡，全寫在臉上，根本無法掩藏，但民主必然會加強主權與人權意識，而選舉就是為了實現人民當家作主的理...,2011-12-09,Apple Daily
人 不 輕 狂 枉 少 年   然 後 呢 （ 張 瑞 雄 ）,https://www.appledaily.com.tw/appledaily/article/headline/20111209/33875504/,但名字可以改，你的長相卻無法改（當然除非你去變臉）！民進黨副總統參選人蘇嘉全的夫人洪恆珠與「椰林基金會貴婦團」的錄影光碟...,2011-12-09,Apple Daily
妻 看 猛 男 秀   蘇 嘉 全 火 速 道 歉,https://www.appledaily.com.tw/appledaily/article/headline/20111209/33875716/,相較先前豪華農舍事件，蘇嘉全拖了兩周才出面宣布捐農舍，這次明快許多。據了解，幕僚認為此事不應讓對手有炒作空間，且此事與農...,2011-12-09,Apple Daily
三 隻 小 豬 1 0 日 回 娘 家 　 綠 營 頭 疼,https://tw.news.appledaily.com/politics/realtime/20111208/100014/,民進黨「三隻小豬」後天(10日)要回娘家，台南市蔡英文總部與各立委候選人總部，已陸續展開回收工作。但愈來愈多的小豬撲滿，...,2011-12-08,Apple Daily
宇 昌 案 被 質 疑 　 綠 ： 馬 政 府 也 投 資,https://tw.news.appledaily.com/politics/realtime/20111208/100000/,針對宇昌案遭質疑圖利，民進黨發言人陳其邁今與律師連元龍舉行記者會，陳其邁說，如果國民黨認為宇昌是弊案，為什麼馬政府去年還...,2011-12-08,Apple Daily
投 資 宇 昌 被 指 圖 利 　 機 密 文 件 1 周 解 密,https://tw.news.appledaily.com/politics/realtime/20111208/99991/,立法院經濟委員會今邀經建會主委、國發基金召集人劉憶，報告國發基金投資宇昌生技公司和台懋生技創投公司一案，會中決議於1周內...,2011-12-08,Apple Daily
蔡 英 文 勞 工 政 策 　 發 社 會 新 鮮 人 失 業 津 貼,https://tw.news.appledaily.com/politics/realtime/20111208/99980/,民進黨總統參選人蔡英文今發表勞工政策，主打搶救勞工，並提出4項主張，包括發放首度求職青年的「失業津貼」、提高失業給付的實...,2011-12-08,Apple Daily
綠 營 目 標 　 雲 嘉 南 要 贏 7 0 萬 票,https://tw.news.appledaily.com/politics/realtime/20111208/99976/,民進黨總統參選人蔡英文進行台17線造勢第3天，走訪嘉義、台南、雲林，從嘉義縣布袋鎮出發，抵達台南市七股區後，再到雲林縣北...,2011-12-08,Apple Daily
蘇 妻 看 猛 男 秀 　 藍 營 諷 蔡 英 文 選 人 眼 光 差,https://tw.news.appledaily.com/politics/realtime/20111208/99973/,民進黨副總統參選人蘇嘉全妻子洪恆珠看猛男秀遭立委邱毅踢爆，國民黨立院黨團今天舉行記者會，立委洪秀柱譏諷蔡英文：「選人的眼...,2011-12-08,Apple Daily
馬 蔡 宋 強 碰   雲 林 搶 農 漁 票,https://www.appledaily.com.tw/appledaily/article/headline/20111208/33872463/,國民黨昨到雲林斗六市召開行動中常會，前縣長許文志、議長蘇金煌、國策顧問布袋戲大師黃俊雄等地方大老都與會。馬英九強調，對非...,2011-12-08,Apple Daily
醜 事 連 環 爆   拖 累 蔡 蘇 選 情,https://www.appledaily.com.tw/appledaily/article/headline/20111208/33872697/,洪恆珠雖警官出身，但在蘇嘉全仕途中一路爭議不斷，蘇任內政部長時，洪開賓士車外出皮包被搶，一天內就破案，被指官夫人的案件特...,2011-12-08,Apple Daily
邱 毅 爆   蘇 嘉 全 妻   看 猛 男 跳 艷 舞,https://www.appledaily.com.tw/appledaily/article/headline/20111208/33872682/,"記者昨深夜撥通洪恆珠手機，一位女子接聽後表示，洪不方便說話，隨即掛斷。
蘇嘉全辦公室幕僚表示，要先了解狀況後再對外說明。...",2011-12-08,Apple Daily
怕 被 指 遭 拔 樁 　 朝 天 宮 董 座 先 表 態 挺 馬,https://tw.news.appledaily.com/politics/realtime/20111207/99871/,民進黨總統參選人蔡英文進行台17線造勢，透過拜訪藍營地方人士，營造外界拔樁聯想，她明晚將到雲林北港朝天宮參拜。為避免外界...,2011-12-07,Apple Daily
選 戰 3 0 天 　 蔡 英 文 攻 千 個 菜 市 場,https://tw.news.appledaily.com/politics/realtime/20111207/99828/,為迎接選戰進入倒數30天，民進黨總統參選人蔡英文下周三將啟動「1000個菜市場總動員」活動，屆時蔡英文將率綠營天王，兵分...,2011-12-07,Apple Daily
拔 椿 ？ 蔡 英 文 ： 別 把 鄉 鎮 長 當 樁 腳,https://tw.news.appledaily.com/politics/realtime/20111207/99711/,民進黨總統參選人蔡英文的「台17線」行程，和田中鎮鎮長、絲襪工廠老闆和國民黨基層鄉代接觸，讓藍營吃驚基層面鬆動。蔡英文說...,2011-12-07,Apple Daily
後 天 總 統 大 選 抽 籤 　 3 參 選 人 全 找 代 打,https://tw.news.appledaily.com/politics/realtime/20111207/99680/,"中選會後天將進行總統大選號次抽韱，巧的是，3黨參選人都不會現身，委由其他人代為抽籤。

馬吳配將由副總統蕭萬長以競選...",2011-12-07,Apple Daily
蔡 英 文   周 美 青   台 1 7 線 拼 吃 蚵 仔,https://www.appledaily.com.tw/appledaily/article/headline/20111207/33869293/,蔡英文昨從彰化鹿港天后宮出發，將走訪西部海線的彰化、雲林、嘉義、台南、高雄五縣巿。蔡說，西濱地區是全台生活條件和環境最艱...,2011-12-07,Apple Daily
宋 訪 嘉 義 開 火   斥 馬 「 沒 政 績 」,https://www.appledaily.com.tw/appledaily/article/headline/20111207/33869304/,國民黨輔選人士說，日前宋接受外媒專訪刻意提遵守中華民國憲法、支持統一，辯論時又多次打民進黨總統參選人蔡英文，甚至幫馬英九...,2011-12-07,Apple Daily
以 豬 換 豬 　 台 南 推 限 定 版 「 白 色 羅 賓 漢 」,https://tw.news.appledaily.com/politics/realtime/20111206/99512/,民進黨本月10日即將舉辦「三隻小豬回娘家」活動，台南競選總部表示，由於許多民眾反映，小豬實在太可愛，紛紛傳出「惜豬」現象...,2011-12-06,Apple Daily
都 走 台 1 7 線 ！ 周 美 青 訪 漁 村 　 蔡 英 文 拜 媽 祖 廟,https://tw.news.appledaily.com/politics/realtime/20111206/99509/,總統夫人周美青，今天走訪雲林台17線參訪漁村產業，在漁村內的「阿源餐廳」用餐，花了1200元，點了什錦炒麵、蚵仔、香螺、...,2011-12-06,Apple Daily
蔡 英 文 走 台 1 7 線 ： 會 像 媽 祖 照 顧 人 民,https://tw.news.appledaily.com/politics/realtime/20111206/99452/,"民進黨總統參選人蔡英文，今天展開4天的「台17線─媽祖文化行腳」造勢行程，上午從鹿港天后宮出發，將走訪西部海線5縣巿。
...",2011-12-06,Apple Daily
酷 酷 嫂 輔 選 　 宋 嘲 馬 沒 政 績 還 要 選,https://tw.news.appledaily.com/politics/realtime/20111206/99447/,親民黨總統參選人宋楚瑜，今天在嘉義訪問，媒體問國民黨總統參選人馬英九提前「打夫人牌」，周美青昨天到嘉義低調輔選，宋說，馬...,2011-12-06,Apple Daily
蔡 英 文 拔 藍 樁   拜 會 田 中 鎮 長,https://www.appledaily.com.tw/appledaily/article/headline/20111206/33866982/, 蔡英文與鄭俊雄昨在媒體前談二十分鐘，兩人不時交頭接耳，鄭說：「我是國民黨，還是鎮黨部主委，但我們的從政同志有沒有真正用...,2011-12-06,Apple Daily
模 糊 迴 避 原 來 很 可 怕 （ 張 大 春 ）,https://www.appledaily.com.tw/appledaily/article/headline/20111206/33866733/,無論試圖在電視辯論這個秀場上吸引或鞏固什麼樣的選民，蔡英文過去一周以來不斷使用模糊的語言為民進黨無中生有的「兩元柿子」作...,2011-12-06,Apple Daily
激 戰 區 出 怪 招   對 手 跳 腳,https://www.appledaily.com.tw/appledaily/article/headline/20111206/33867149/,陳致中以無黨籍參選，但競選看板卻都高掛民進黨總統參選人蔡英文的照片，民進黨形容陳是「加盟店，並非直營店」，但也沒有強烈要...,2011-12-06,Apple Daily
馬 英 九 中 彩 券 卻 丟 扁 擔 （ 陳 茂 雄 ）,https://www.appledaily.com.tw/appledaily/article/headline/20111206/33866729/,馬團隊估算，扁案會使民進黨十年翻不了身，所以他們並不操心2012年的總統大選。他們沒有想到蔡英文接任黨主席就已經柔性切割...,2011-12-06,Apple Daily
辯 論 後 台 股 小 跌 低 量 觀 望,https://www.appledaily.com.tw/appledaily/article/finance/20111206/33866241/,首場總統大選辯論，僅就民調影響股市部分加以分析。根據各家最新民調，馬總統及蔡英文的差距仍然不大，宋楚瑜維持10%，未來總...,2011-12-06,Apple Daily
蔡 造 勢 沒 插 國 旗 　 藍 委 問 國 號 係 啥 密 ？,https://tw.news.appledaily.com/politics/realtime/20111205/99169/,立院國民黨團今天早上召開記者會，黨團副書記長潘維剛質疑，民進黨總統參選人蔡英文曾說「台灣現在的名字叫中華民國」，但潘拿出...,2011-12-05,Apple Daily
田 中 鎮 長 「 切 心 」 　 蔡 英 文 趁 機 拔 樁,https://tw.news.appledaily.com/politics/realtime/20111205/99153/,《聯合晚報》報導，民進黨總統參選人蔡英文昨晚突然入住國民黨籍田中鎮長鄭俊雄的家中，拔樁意味濃厚，國民黨完全不知情，得知消...,2011-12-05,Apple Daily
蔡 英 文 推 甩 甩 A p p 　 搶 攻 年 輕 選 票,https://tw.news.appledaily.com/politics/realtime/20111205/99078/,民進黨總統參選人蔡英文本月10日將推「小豬回娘家」，在凱達格蘭大道上進行大型活動。當天使用智慧型手機的民眾，可玩「小英甩...,2011-12-05,Apple Daily
馬 l o n g   s t a y 　 綠 罵 「 笨 蛋 ！ 問 題 在 政 績 ！ 」,https://tw.news.appledaily.com/politics/realtime/20111205/99056/,馬英九總統將回到南部long stay，民進黨一點也不擔心。民進黨發言人林俊憲今受訪時表示，民進黨總統參選人蔡英文今展開...,2011-12-05,Apple Daily
掛 蔡 英 文 照 片   陳 致 中 被 虧 「 加 盟 店 」,https://www.appledaily.com.tw/appledaily/article/headline/20111205/33864319/,與陳致中同選區的民進黨參選人郭玟成說，要為阿扁討公道並非選立委可以解決，坊間有人說要配票，「配票穩輸的，選民要用智慧投下...,2011-12-05,Apple Daily
司 馬 觀 點 ： 首 位 女 性 總 統 參 選 人 （ 江 春 男 ）,https://www.appledaily.com.tw/appledaily/article/headline/20111205/33864399/,一般而言，執政者都忙著替政績和政策辯護，處於守勢，情勢較不利。但這次馬英九主動出擊，反守為攻，發動對綠營前朝的抨擊，逼蔡...,2011-12-05,Apple Daily
蔡 ： 讓 大 家 住 得 起 台 北,https://www.appledaily.com.tw/appledaily/article/headline/20111205/33864305/,蔡英文說，北市已變成有錢人才住得起的地方，「這是不對的」，未來她執政要進行政府主導的都市更新，讓大台北都會有公平的居住正...,2011-12-05,Apple Daily
蘋 論 ： 馬 蔡 與 黨   誰 改 變 了 誰,https://www.appledaily.com.tw/appledaily/article/headline/20111205/33864395/,首先，馬把蔡和扁綁在一起的戰略是否有效？其具體做法是不斷把問題歸咎前朝、指出前朝從總統到政務官數十人因貪腐入獄，連蔡競選...,2011-12-05,Apple Daily
馬 ： 蔡 護 短 「 用 扁 愛 將 」,https://www.appledaily.com.tw/appledaily/article/headline/20111205/33864312/,此外，馬英九為藍委羅淑蕾站台時，讚許羅是很另類的立委，白天當立委、晚上上三立電視台談話節目批評行政官員，但國民黨能容忍，...,2011-12-05,Apple Daily
宋 談 林 瑞 雄 優 勢   「 沒 接 班 問 題 」,https://www.appledaily.com.tw/appledaily/article/headline/20111205/33864325/,林瑞雄還批吳揆說：「巧言令色沒有一個是仁的嘛！」、「就這一句話，他們怎麼可以跟我辯論？」他重申，將會「兵來將擋，水來土掩...,2011-12-05,Apple Daily
辣 蘋 果 專 欄 ： 馬 別 老 當 在 野 黨,https://www.appledaily.com.tw/appledaily/article/headline/20111205/33864329/,雖然不少民調顯示，馬英九在辯論的表現不錯，但這只是就辯論技巧而言，換言之，技巧不等於內涵，充其量只能說馬英九辯得好，不代...,2011-12-05,Apple Daily
有 激 情 口 號 沒 核 心 問 題 （ 趙 祥 亨 ）,https://www.appledaily.com.tw/appledaily/article/headline/20111205/33864950/,二、關於兩岸問題。兩岸問題在三位候選人的政見，無論是「不統、不獨、不武」、「九二共識」或「台灣共識」，這些政治用語都使得...,2011-12-05,Apple Daily
大 選 關 鍵 在 兩 岸 及 經 濟 （ 孫 慶 餘 ）,https://www.appledaily.com.tw/appledaily/article/headline/20111205/33864946/,而從前天辯論看，不幸這二大議題分別為馬蔡最大罩門。馬英九反守為攻，把許多執政缺失美化成重大貢獻，倒黑為白積非成是。蔡英文...,2011-12-05,Apple Daily
蘇 貞 昌 今 3 7 年 婚 慶 ： 奉 獻 尪 婿 要 有 覺 悟,https://tw.news.appledaily.com/politics/realtime/20111204/98930/,前行政院長、民進黨蔡英文競選總部主委蘇貞昌，今天結婚37周年，但卻南北奔波衝衝衝助選，只與妻子共同吃早餐度過。晚間蘇貞昌...,2011-12-04,Apple Daily
屏 東 同 鄉 喊 凍 蒜 　 蘇 嘉 全 ： 很 溫 暖,https://tw.news.appledaily.com/politics/realtime/20111204/98917/,民進黨副總統參選人蘇嘉全，今天晚間出席在新北市新莊區舉辦的「屏東旅北同鄉會」活動，全場席開50餘桌，座無虛席，出席餐會同...,2011-12-04,Apple Daily
蔡 英 文 南 投 拚 過 半 　 籲 讓 馬 休 息 一 下,https://tw.news.appledaily.com/politics/realtime/20111204/98915/,民進黨總統參選人蔡英文，今天出席南投縣競選總部成立大會表示，南投人歷經921震災，與民進黨一樣都從挫敗中重新站起來，她期...,2011-12-04,Apple Daily
槍 傷 後 首 度 同 台 助 選 　 馬 送 連 勝 文 平 安 符,https://tw.news.appledaily.com/politics/realtime/20111204/98906/,今天國民黨總統候選人馬英九，和國民黨榮譽主席連戰之子連勝文，一起現身替立委參選人丁守中造勢，這是連勝文遭槍擊案後，首度和...,2011-12-04,Apple Daily
綠 營 振 奮 ： 蔡 脫 胎 換 骨 　 氣 勢 會 看 漲,https://tw.news.appledaily.com/politics/realtime/20111204/98872/,總統大選首場辯論會昨天下午舉行，民進黨發言人莊瑞雄今天表示，看完昨天辯論後，大家都很振奮，蔡英文與上次辯論比較，又是不一...,2011-12-04,Apple Daily
謝 長 廷 揶 揄 ： 馬 沒 扁 　 可 能 較 難 騙,https://tw.news.appledaily.com/politics/realtime/20111204/98871/,民進黨總統參選人蔡英文的競選總部總指揮謝長廷，今天出席蔡英文台北市競選總部成立大會時，針對昨天的總統辯論會表示，如果要看...,2011-12-04,Apple Daily
中 國 網 友 ： 宋 有 大 局 　 雙 英 演 講 有 進 步,https://tw.news.appledaily.com/politics/realtime/20111204/98866/,台灣昨天進行本屆總統大選首場辯論會，中國「新浪網」就開闢台灣「領導人」選舉辯論會專題，供網友了解辯論情況，並留言微博發表...,2011-12-04,Apple Daily
徐 佳 青 ： 馬 想 留 在 2 0 0 8 就 成 全 他,https://tw.news.appledaily.com/politics/realtime/20111204/98855/,對於國民黨總統參選人馬英九，今天再攻民進黨總統參選人蔡英文競選團隊重用扁系，蔡競總發言人徐佳青表示，馬總統既然這麼思念阿...,2011-12-04,Apple Daily
掛 與 蔡 英 文 合 照 　 綠 稱 陳 致 中 「 加 盟 店 」,https://tw.news.appledaily.com/politics/realtime/20111204/98847/,對於前總統陳水扁之子陳致中的立委競選總部成立，使用與民進黨統參選人蔡英文的合照，蔡營發言人徐佳青表示，蔡英文是台灣社會的...,2011-12-04,Apple Daily
因 應 副 總 統 辯 論 會 　 蘇 嘉 全 魔 鬼 訓 練,https://tw.news.appledaily.com/politics/realtime/20111204/98815/,本月10日將進行副總統參選人辦論。民進黨競選幕僚也證實，副總統參選人蘇嘉全已經接受密集訓練，猛啃資料備戰，尤其是農舍事件...,2011-12-04,Apple Daily
蔡 英 文 桃 競 選 總 部 成 立 　 批 馬 只 認 得 數 字,https://tw.news.appledaily.com/politics/realtime/20111204/98813/,蔡英文在桃園市競選總部今天上午舉行成立大會，現場有1萬6千名民眾到場力挺小英，蔡英文說國民黨總統候選人馬英九現在很會罵人...,2011-12-04,Apple Daily
呂 秀 蓮 ： 馬 若 再 執 政 台 灣 將 破 產,https://tw.news.appledaily.com/politics/realtime/20111204/98808/,前副總統呂秀蓮今出席台北市競選總部成立大會時表示，總統馬英九執政3年半，負債1兆3500多億元，若讓馬繼續執政，恐怕會讓...,2011-12-04,Apple Daily
蔡 英 文 誓 言 推 翻 　 有 錢 才 能 住 北 市,https://tw.news.appledaily.com/politics/realtime/20111204/98804/,民進黨總統候選人蔡英文今出席台北市競選總部成立大會時表示，有很多人說「台北市不是民進黨的地方」，但這不是事實，她強調台北...,2011-12-04,Apple Daily
馬 英 九 諷 綠 　 改 革 決 心 不 如 國 民 黨,https://tw.news.appledaily.com/politics/realtime/20111204/98800/,國民黨總統參選人馬英九今出席板橋區立委參選人江惠貞競選總部成立大會，延續昨總統大選辯論的攻勢，抨擊民進黨總統參選人蔡英文...,2011-12-04,Apple Daily
沒 有 假 設 　 蔡 英 文 笑 說 「 我 一 定 當 總 統 」,https://tw.news.appledaily.com/politics/realtime/20111204/98760/,"民進黨總統參選人蔡英文的台北市競選總部今天成立，上千人前往現場為蔡英文加油打氣，選民包圍蔡英文，搶著和她握手。

蔡...",2011-12-04,Apple Daily
《 蘋 果 》 民 調 　 馬 英 九 領 先 蔡 英 文 1 0 %,https://tw.news.appledaily.com/politics/realtime/20111204/98715/,總統參選人首場辯論會昨天登場，《蘋果》針對20歲以上的民眾進行355份問卷，結果發現馬英九支持率上升，和蔡英文差距來到1...,2011-12-04,Apple Daily
馬 猛 轟 貪 腐   企 圖 連 結 扁 蔡,https://www.appledaily.com.tw/appledaily/article/headline/20111204/33863101/,馬英九一開始申論就不斷質疑民進黨執政貪腐，「蔡主席大概忘記了，但台灣人民都沒有忘記。」試圖將蔡與扁連結。馬說，民進黨執政...,2011-12-04,Apple Daily
屢 被 提 起   扁 「 無 所 不 在 」,https://www.appledaily.com.tw/appledaily/article/headline/20111204/33863114/,馬英九隨後回答時說，不用等審判完也可以答，問題是「要不要」，不應拖延，「對特赦問題，蔡主席常都是迴避。」蔡在會後記者會強...,2011-12-04,Apple Daily
媒 體 嗆 6 3 3 跳 票   馬 再 道 歉 一 次,https://www.appledaily.com.tw/appledaily/article/headline/20111204/33863130/,馬英九並批，蔡英文說4年內要讓國家債務減半，「這實在是非常的有雄心」， 但是否要大量加稅，把預算砍一半才做得到？蔡則反嗆...,2011-12-04,Apple Daily
蔡 穩 健   馬 嗆 辣   宋 熄 火,https://www.appledaily.com.tw/appledaily/article/headline/20111204/33863081/,學者認為這場辯論馬英九攻擊火力強、臨機應變佳，整體表現較好；蔡英文攻擊不慍不火，但易被激怒擺臭臉；宋楚瑜表現不如預期，連...,2011-12-04,Apple Daily
西 裝 T 恤   蔡 「 缺 女 性 特 質 」,https://www.appledaily.com.tw/appledaily/article/headline/20111204/33863124/,"時尚觀察家袁青
造型師陳孫華
台灣師範大學大傳所教授胡幼偉
文化大學廣告系副教授鈕則勳
註：滿分為10分
...",2011-12-04,Apple Daily
蔡 駁 九 二 共 識   馬 酸 台 灣 共 識,https://www.appledaily.com.tw/appledaily/article/headline/20111204/33863110/,"宋則說，台灣人都有真正的共識，「我們都是台灣人，這不是台灣共識嗎？」
媒體詢問蔡拒絕承認九二共識，卻又要成立兩岸工作小組...",2011-12-04,Apple Daily
馬 蔡 宋 造 型 　 造 型 師 ： 規 矩 不 花 俏,https://tw.news.appledaily.com/politics/realtime/20111203/98671/,"總統大選電視辯論今天登場，知名造型師林國基與林葉亭分別評價3位參選人服裝與整體造型。
 
林國基說，總統馬...",2011-12-03,Apple Daily
高 俊 明 率 長 老 教 會 　 公 開 支 持 蔡 英 文,https://tw.news.appledaily.com/politics/realtime/20111203/98637/,"「台灣基督長老教會」前總幹事高俊明，今天率多位牧者，共同推薦民進黨總統參選人蔡英文。
 
高俊明指出，「台...",2011-12-03,Apple Daily
馬 蔡 宋 1 2 時 陸 續 就 定 位 　 皆 穿 深 色 服 裝,https://tw.news.appledaily.com/politics/realtime/20111203/98620/,首場總統辯論會今天下午舉行，國民黨參選人馬英九帶夫人周美青在12點07分最先到場，馬著深色西裝，打香檳金底色、黑條紋領帶...,2011-12-03,Apple Daily
