titles,links,content,time,media
首 場 電 視 政 見 　 宋 楚 瑜 左 右 開 弓 批 藍 打 綠,https://tw.news.appledaily.com/politics/realtime/20111223/102415/,2012總統大選總統候選人首場電視政見會，第一階段政見發表中，親民黨主席宋楚瑜左右開弓、批藍打綠，認為馬英九與蔡英文「都...,2011-12-23,Apple Daily
首 場 電 視 政 見 　 蔡 英 文 批 馬 口 號 治 國,https://tw.news.appledaily.com/politics/realtime/20111223/102414/,2012總統大選總統候選人首場電視政見會，今晚8時在華視直播，由柴松林主持。首先發表政見的民進黨總統候選人蔡英文，緊咬馬...,2011-12-23,Apple Daily
陳 亭 妃 推 小 豬 夯 包 　 公 佈 挺 台 灣 密 碼,https://tw.news.appledaily.com/politics/realtime/20111223/102397/,"民進黨台南市立委候選人陳亭妃總部，今天獨家推出「小豬夯包」，並公布「挺台灣密碼123」。
 
「小豬夯包」...",2011-12-23,Apple Daily
年 節 搶 選 票 　 藍 綠 各 印 桌 曆 和 賀 年 卡 拚 場,https://tw.news.appledaily.com/politics/realtime/20111223/102391/,民進黨正副總統候選人蔡英文、蘇嘉全大台中市區競選總部，設計1套「龍年」小英限量3000份賀年明信片，1套5張，內容以龍年...,2011-12-23,Apple Daily
反 駁 九 二 共 識 　 李 登 輝 轟 馬 英 九 扭 曲 欺 騙,https://tw.news.appledaily.com/politics/realtime/20111223/102383/,"之前國民黨總統候選人馬英九接受媒體專訪，重申「九二共識」是前總統李登輝決定的，李登輝今天下午新聞稿反駁。
 ...",2011-12-23,Apple Daily
選 前 三 周 拚 造 勢 　 1 8 0 0 0 小 豬 打 造 凱 旋 門,https://tw.news.appledaily.com/politics/realtime/20111223/102377/,民進黨總統候選人蔡英文發言人徐佳青，今天上午公布選前最後三周造勢活動。預計將從明天聖誕節前夕開始，進行36場造勢晚會，首...,2011-12-23,Apple Daily
經 建 會 冬 至 聚 會 　 劉 憶 如 哽 咽 哭 了,https://tw.news.appledaily.com/politics/realtime/20111223/102375/,經建會主委劉憶如，之前說要針對宇昌案召開記者會五問蔡英文，現在改為本周以書面提問。但可能是壓力太大，在經建會的冬至聚會上...,2011-12-23,Apple Daily
蔡 英 文 3 新 廣 告 　 主 攻 照 顧 青 年 老 人,https://tw.news.appledaily.com/politics/realtime/20111223/102366/,"YouTube-蔡英文政策CF－失業津貼


YouTube-蔡英文政策CF_社會住宅篇 
 
Yo...",2011-12-23,Apple Daily
陪 林 濁 水 拜 票 　 蘇 貞 昌 回 憶 住 過 新 莊,https://tw.news.appledaily.com/politics/realtime/20111223/102363/,民進黨總統候選人蔡英文競選總部主任委員蘇貞昌，今天上午到新北市新莊陪同黨立委候選人林濁水掃街，對於媒體問到關於宇昌案的看...,2011-12-23,Apple Daily
反 擊 馬 英 九 　 綠 指 蔡 英 文 早 說 「 中 華 民 國 就 是 台 灣 」,https://tw.news.appledaily.com/politics/realtime/20111223/102358/,針對國民黨總統候選人馬英九在接受《中國時報》專訪時，指民進黨總統候選人蔡英文「不接受中華民國」，民進黨團幹事長蔡煌瑯今天...,2011-12-23,Apple Daily
列 美 免 簽 後 選 國 　 綠 稱 比 預 期 晚 1 年,https://tw.news.appledaily.com/politics/realtime/20111223/102345/,針對美國宣布台灣列入免簽候選國，民進黨團幹事長蔡煌瑯說，這確實是外交重要成就，民進黨樂見，這是預期中的事，民進黨樂觀其成...,2011-12-23,Apple Daily
民 宅 冒 烈 火 　 住 戶 疑 綠 營 放 沖 天 炮 引 起,https://tw.news.appledaily.com/local/realtime/20111223/102325/,雲林縣北港鎮劉厝里今上午10時許發生民宅火警，火舌由頂樓鐵皮屋竄出，迅速延燒6戶樓頂，幾乎全毀，損失超過3百萬元，起火原...,2011-12-23,Apple Daily
馬 英 九 質 疑 蔡 英 文 　 不 接 受 中 華 民 國,https://tw.news.appledaily.com/politics/realtime/20111223/102321/,九二共識是藍綠攻防戰焦點之一，總統馬英九昨接受《中國時報》專訪，他質疑，「九二共識」就是「一個中國，各自表述」，雙方對「...,2011-12-23,Apple Daily
宇 昌 與 富 邦 （ 趙 少 康 ）,https://www.appledaily.com.tw/appledaily/article/headline/20111223/33907945/,綠營大概以為，你攻我極機密，我也攻你極機密，你攻我六日內批准，我攻你一日內批准，你攻我國發基金官員到蔡英文家裡簡報，我攻...,2011-12-23,Apple Daily
辣 蘋 果 專 欄 ： 林 瑞 雄 高 潮 一 波 波 （ 余 艾 苔 ）,https://www.appledaily.com.tw/appledaily/article/headline/20111223/33908345/,宋楚瑜宣布副手搭檔後，林瑞雄神隱一個多月，誰知出關後，一句「受到電磁波攻擊」馬上成為新聞焦點，還被網友封為「萬磁王」；副...,2011-12-23,Apple Daily
台 灣 拼 上 網 速 度   蔡 ： 5 年 追 上 韓,https://www.appledaily.com.tw/appledaily/article/headline/20111223/33908341/,昨現場有3、4百位學者專家、產業界人士與會。蔡英文致辭時批評，馬政府引以為傲的iTaiwan計劃，實際只有512K，台灣...,2011-12-23,Apple Daily
選 前 3 周 宣 布 「 當 然 對 馬 加 分 」,https://www.appledaily.com.tw/appledaily/article/headline/20111223/33908242/,知情人士透露，早在九月蔡英文訪美時，美方就已告知，若程序完備年底可能宣布將台灣列為免簽候選國，當時就傳出綠營人士透過管道...,2011-12-23,Apple Daily
特 偵 啟 動   查 宇 昌 案   富 邦 獻 金 案,https://www.appledaily.com.tw/appledaily/article/headline/20111223/33908323/,黃世銘昨召開選舉防制暴力記者會，表明選前將掃蕩黑幫、黑槍，媒體一再提問宇昌等案情進展，黃原拒答，但隨後嚴正表示：「再迴避...,2011-12-23,Apple Daily
蘇 嘉 全 澎 湖 拜 票 　 允 諾 6 5 歲 以 上 免 繳 健 保 費,https://tw.news.appledaily.com/politics/realtime/20111222/102235/,民進黨籍副總統參選人蘇嘉全，今天一早飛到澎湖，以一整天車隊繞行方式，跑遍澎湖本島各鄉市，進行旋風式掃街拜票，也炒熱澎湖選...,2011-12-22,Apple Daily
遭 疑 只 辦 綠 　 檢 察 總 長 「 沒 有 不 敢 辦 的 案 子 」,https://tw.news.appledaily.com/politics/realtime/20111222/102221/,藍營猛攻宇昌案，綠營則強打富邦案，民進黨批特偵組只辦綠不辦藍，並控馬政府以國家機器追殺蔡英文，檢察總長黃世銘今天在大選防...,2011-12-22,Apple Daily
蔡 戀 情 像 沈 佳 宜 　 蔡 煌 瑯 讚 ： 氣 質 大 美 女,https://tw.news.appledaily.com/politics/realtime/20111222/102158/,針對《財訊》披露蔡英文大學情史，直指蔡當年在台大法律系就讀時與同班同學的情史，彷彿是電影《那些年，我們一起追的女孩》劇情...,2011-12-22,Apple Daily
大 學 很 多 人 追   蔡 英 文 像 沈 佳 宜,https://www.appledaily.com.tw/appledaily/article/headline/20111222/33905774/,根據《財訊》報導，指蔡英文台大法律系就讀期間，就像《那些年，我們一起追的女孩》的女主角沈佳宜，是個做事一板一眼、乖巧用功...,2011-12-22,Apple Daily
宇 昌 案 風 波   綠 批 二 次 變 造   藍 轟 自 導 自 演,https://www.appledaily.com.tw/appledaily/article/headline/20111222/33905814/,民進黨昨記者會出示國發基金在2007年8月31日彙整的投資宇昌案卷宗，共有6個附件，其中附件三是新版投資說明書，指經建會...,2011-12-22,Apple Daily
搶 攻 立 院   藍 拼 6 0 席   綠 搶 5 0 席,https://www.appledaily.com.tw/appledaily/article/headline/20111222/33905805/,國民黨黨政人士透露，政黨支持度國民黨領先，17席不分區立委應是最基本。投票率拉高將有助鞏固北部、東部及外島等藍營優勢區選...,2011-12-22,Apple Daily
「 怎 樣 都 不 對 」 　 監 委 不 敢 辦 宇 昌 案,https://tw.news.appledaily.com/politics/realtime/20111221/102052/,宇昌案近日發燒，特偵組已開始調閱相關資料，監委葉耀鵬今天上午在台灣競爭力論壇上表示，國民黨籍立委邱毅多次找他陳情，但他不...,2011-12-21,Apple Daily
企 業 界 表 態 　 魏 應 充 魏 平 祺 挺 馬 英 九,https://tw.news.appledaily.com/politics/realtime/20111221/102035/,全國工商團體支持馬吳後援會，今天在台中市成立，味全董事長魏應充、台灣區織襪同業公會理事長魏平祺、綠能產業後援會會長郭興中...,2011-12-21,Apple Daily
蔡 英 文 學 生 時 情 史       宛 如 《 那 些 年 》 翻 版,https://tw.news.appledaily.com/politics/realtime/20111221/102030/,最新出版《財訊》報導，民進黨總統候選人蔡英文在台大法律系就讀情史，宛如電影《那些年，我們一起追的女孩》翻版，做事一板一眼...,2011-12-21,Apple Daily
被 批 打 手 　 劉 憶 如 ： 我 是 盡 忠 職 守,https://tw.news.appledaily.com/politics/realtime/20111221/101982/,宇昌案風波持續，綠營批經建會主委劉憶如淪藍營打手，劉憶如今天上午受訪時說，她是盡忠職守，是立院要求報告這個案子，發現其中...,2011-12-21,Apple Daily
蔡 訪 科 技 界   允 擴 大 光 電 內 需,https://www.appledaily.com.tw/appledaily/article/headline/20111221/33902052/,經建會主委劉憶如將就宇昌生技案向蔡英文提出疑問，蔡昨說，政務官要做的是國家的事及經濟產業發展，不是做為選舉工具，「劉憶如...,2011-12-21,Apple Daily
選 戰 創 意 P K   馬 艷 文 尬 蔡 女 王,https://www.appledaily.com.tw/appledaily/article/headline/20111221/33902048/,民進黨陣營則從實體與虛擬空間雙管齊下，近日推出公車廣告，車身印有「買車票，去投票」，號召年輕人返鄉投票。「小英姐妹會」推...,2011-12-21,Apple Daily
蔡 背 千 萬 房 貸   馬 存 款 7 千 萬 最 多,https://www.appledaily.com.tw/appledaily/article/headline/20111221/33902055/,馬英九財產與今年3月向監察院申報相較變動不大，當時現金19萬元、存款7081萬元，如今現金零，存款略增為7372萬元，原...,2011-12-21,Apple Daily
吳 蘇 搶 票   決 戰 台 中   互 罵 「 無 能 」,https://www.appledaily.com.tw/appledaily/article/headline/20111221/33902041/,相較於蘇嘉全固守中台灣，吳敦義上周請假參選後，也把火力集中在中台灣，和蘇一較高下。吳說，馬英九總統跑全國行程，他主攻中台...,2011-12-21,Apple Daily
蔡 英 文 訪 兒 童 中 心 　 誤 問 社 工 「 妳 幾 年 級 ？ 」,https://tw.news.appledaily.com/politics/realtime/20111220/101913/,民進黨總統候選人蔡英文，今天下午前往新竹縣德蘭兒童中心探視，並問候每一位在場的小朋友。蔡英文一眼望向最後一排，問「妳唸幾...,2011-12-20,Apple Daily
馬 吳 台 中 市 競 選 總 部 　 控 告 綠 營 違 法,https://tw.news.appledaily.com/politics/realtime/20111220/101894/,賄選傳聞滿天飛，馬吳台中市競選辦公室總幹事杜建德今天在兩名律師陪同下，舉行記者會，針對上周四大雅農會傳出國民黨籍候選人楊...,2011-12-20,Apple Daily
林 瑞 雄 笑 連 戰 郁 慕 明 　 去 「 那 邊 」 像 哈 巴 狗,https://tw.news.appledaily.com/politics/realtime/20111220/101865/,親民黨副總統候選人林瑞雄今天上午受訪，再批藍綠總統候選人馬蔡兩人，他說，蔡英文沒有決斷力，很多話不敢講；馬英九則有超過六...,2011-12-20,Apple Daily
藍 綠 黨 團 掛 布 條 　 隔 樓 梯 叫 陣 宇 昌 案,https://tw.news.appledaily.com/politics/realtime/20111220/101841/,國民黨立院黨團原定今天繼續追打宇昌案，但因北韓領導人金正日猝逝而緊急喊卡。不過，藍綠黨團角力並未停歇，民進黨團早已掛出「...,2011-12-20,Apple Daily
宇 昌 案 風 波 　 蔡 英 文 批 劉 憶 如 太 超 過,https://tw.news.appledaily.com/politics/realtime/20111220/101833/,經建會主委劉憶如擬於明天，針對宇昌案中的疑點對民進黨主席蔡英文提問。蔡英文今天被媒體詢及此事時，嚴肅表示，她要說清楚的，...,2011-12-20,Apple Daily
周 五 出 面 挺 蔡 　 李 登 輝 幕 僚 ： 不 可 能,https://tw.news.appledaily.com/politics/realtime/20111220/101832/,"YouTube-政黨票是啥? 阿輝伯解釋給你聽


「李登輝學校」將在本周五舉辦年終餐敘，由於適逢前總統李登輝90...",2011-12-20,Apple Daily
豬 隻 疫 苗 市 場 遭 獨 佔 　 養 豬 協 會 痛 批 滅 農,https://tw.news.appledaily.com/politics/realtime/20111220/101831/,雲林、嘉義、台南、高雄、屏東5縣市養豬協會，今天中午在蔡英文、李進勇雲林競選總本部開記者會，抨擊馬政府縱容豬隻疫苗成為「...,2011-12-20,Apple Daily
富 邦 案 　 吳 敦 義 嗆 綠 烏 賊 噴 墨,https://tw.news.appledaily.com/politics/realtime/20111220/101819/,國民黨副總統候選人吳敦義，今天上午在台中大雅、神岡拜訪農會及參拜廟宇。媒體問到富邦案，吳表示，民進黨執政時的財政部長，都...,2011-12-20,Apple Daily
「 他 像 史 豔 文 」 布 袋 戲 大 師 黃 俊 雄 挺 馬,https://tw.news.appledaily.com/politics/realtime/20111220/101810/,"黃俊雄-領導特質篇


馬吳競選總部今天公布最新競選影片—「我所認識的馬英九系列」，布袋戲大師黃俊雄、...",2011-12-20,Apple Daily
否 認 挺 蔡 　 翁 啟 惠 ： 談 話 被 誤 導,https://tw.news.appledaily.com/politics/realtime/20111220/101797/,曾任宇昌公司董事的中研院長翁啟惠，日前直言宇昌案牽連無辜，被外界解讀為力挺民進黨總統候選人蔡英文，翁啟惠今天被問及此事，...,2011-12-20,Apple Daily
蘇 貞 昌 忙 拉 票 　 講 到 喉 嚨 出 血,https://tw.news.appledaily.com/politics/realtime/20111220/101794/,《聯合報》報導，行政院前院長蘇貞昌今天上午前往新北市板橋區，為民進黨立委候選人羅致政拜票，他不忘拉總統票，要大家支持民進...,2011-12-20,Apple Daily
蔡 被 控 搬 錢 1 4 億   民 進 黨 告 吳 敦 義,https://www.appledaily.com.tw/appledaily/article/headline/20111220/33899804/,黃帝穎表示，國發基金當初投資給宇昌的總額是2億6400萬元，不過2007年5月蔡英文已卸任副院長，2008年3月國發基金...,2011-12-20,Apple Daily
馬 ： 富 邦 魚 翅 宴   在 併 購 後,https://www.appledaily.com.tw/appledaily/article/headline/20111220/33899788/,馬英九說，民進黨所稱5次魚翅宴，僅2002年9月16日、2003年8月11日兩次是富邦邀宴，且是北銀和富邦合併換股案公布...,2011-12-20,Apple Daily
辣 蘋 果 專 欄 ： 白 冰 冰 幫 倒 忙 （ 余 艾 苔 ）,https://www.appledaily.com.tw/appledaily/article/headline/20111220/33899819/,找藝人助選有好有壞，好的是可帶動氣氛，加上民眾看明星的心理，也有助於匯聚人氣；但不好的一面就是藝人平常插科打諢慣了，講話...,2011-12-20,Apple Daily
失 分 的 是 吳 敦 義 （ 張 大 春 ）,https://www.appledaily.com.tw/appledaily/article/headline/20111220/33899358/,吳敦義說：「執政黨應以政績為主」，這話是廢話，但是沒什麼不對；他還說：「要讓民眾了解政府有好的政績」，這話是空洞，但也沒...,2011-12-20,Apple Daily
宋 爆 替 陳 菊 傳 話   促 北 京 勿 擋 世 運,https://www.appledaily.com.tw/appledaily/article/headline/20111220/33899807/,去年10月宋楚瑜也曾透露，是他促成高雄市長陳菊於2009年5月順利訪問中國，但當時遭陳菊陣營否認。宋昨重申，他去幫陳市長...,2011-12-20,Apple Daily
扯 泰 水 患   白 冰 冰 「 歹 勢 」,https://www.appledaily.com.tw/appledaily/article/headline/20111220/33899810/,"馬英九昨說：「她（白冰冰）這樣的說法會引起誤會，不甚妥當，所以她出來澄清並表示歉意，我覺得是正確的。」
白冰冰前天在馬吳...",2011-12-20,Apple Daily
殘 盟 提 身 障 政 策 建 議 　 籲 三 總 統 候 選 人 加 油,https://tw.news.appledaily.com/politics/realtime/20111219/101695/,「殘障聯盟」今天舉辦記者會，公布《身心障礙者對政策建議書》回應，秘書長王幼鈴表示，親民黨總統候選人宋楚瑜沒有回應，國民黨...,2011-12-19,Apple Daily
綠 告 吳 敦 義 　 藍 委 批 浪 費 司 法 資 源,https://tw.news.appledaily.com/politics/realtime/20111219/101692/,"立院國民黨團今天早上召開記者會，藍委潘維剛批評說，富邦已表示沒有政治獻金，她不懂為何蔡英文還要一直抹黑。
 ...",2011-12-19,Apple Daily
總 統 辯 論 總 檢 討 　 荒 腔 走 板 為 馬 拉 票,https://tw.news.appledaily.com/politics/realtime/20111219/101690/,「財團法人21世紀基金會」今天舉行「2012總統大選辯論總檢討」記者會，呈現一片荒腔走板的景象，現場除了「政大國關中心」...,2011-12-19,Apple Daily
馬 英 九 說 明 富 邦 案 　 批 民 進 黨 魚 目 混 珠,https://tw.news.appledaily.com/politics/realtime/20111219/101643/,民進黨連日來緊咬國民黨總統候選人馬英九有無收受富邦獻金，及吃了5次魚翅宴等事，馬英九今天親上火線說明。他強調，他自己及富...,2011-12-19,Apple Daily
宇 昌 案 風 波 　 民 進 黨 再 告 吳 敦 義,https://tw.news.appledaily.com/politics/realtime/20111219/101641/,宇昌案持續延燒，繼日前對經建會主委劉憶如等人提告後，民進黨發言人莊瑞雄今天說，國民黨副總統候選人吳敦義日前指蔡英文在副院...,2011-12-19,Apple Daily
總 統 男 或 女 　 宋 ： 能 力 才 是 問 題,https://tw.news.appledaily.com/politics/realtime/20111219/101639/,藝人白冰冰昨為國民黨總統候選人馬英九站台時，說出泰國選女總統就淹大水，引發各界批評。親民黨總統候選人宋楚瑜今天上午在高雄...,2011-12-19,Apple Daily
司 馬 觀 點 ： 蔡 英 文 下 戰 書 （ 江 春 男 ）,https://www.appledaily.com.tw/appledaily/article/headline/20111219/33898013/,宇昌案對蔡英文的民調無傷，再談下去，國民黨明顯不利，但樹欲靜而風不止，蔡英文在辯論會前夕舉行記者會，譴責國民黨操弄國家機...,2011-12-19,Apple Daily
蔡 英 文 再 轟 馬   吃 富 邦 魚 翅 宴,https://www.appledaily.com.tw/appledaily/article/headline/20111219/33897619/,針對蔡英文質疑，富邦金控董事長蔡明忠昨澄清，2008年沒有捐1500萬元政治獻金給馬英九。蔡明忠說，他父親（蔡萬才）在法...,2011-12-19,Apple Daily
劉 憶 如 下 戰 帖   明 提 宇 昌 疑 點,https://www.appledaily.com.tw/appledaily/article/headline/20111219/33897634/,劉憶如說，因國發基金投資宇昌的案子過於複雜，又與國發基金另外兩案南華生技與台懋創投相關，外界不易了解，因此希望雙方可就事...,2011-12-19,Apple Daily
白 冰 冰 ： 泰 國 選 女 總 統   馬 上 淹 大 水,https://www.appledaily.com.tw/appledaily/article/headline/20111219/33897639/,網友Felix76116直言：「人家國家的災難 用領導人的性別來簡化哦？」另一名網友jeff0811則認為「她是在幫哪邊...,2011-12-19,Apple Daily
神 奇 4 0 小 時   燒 聲 小 英 復 元 開 砲,https://www.appledaily.com.tw/appledaily/article/headline/20111219/33897647/,雖然蔡英文強調治療過程是遵照醫師指示，但幕僚透露，蔡辯論前曾打了消炎針。而蔡昨連跑7個行程，儘管聲音沒恢復、說話吃力，也...,2011-12-19,Apple Daily
辣 蘋 果 專 欄 ： 幸 好 有 宋 楚 瑜 （ 余 艾 苔 ）,https://www.appledaily.com.tw/appledaily/article/headline/20111219/33897657/,當馬英九、蔡英文捉對廝殺時，宋楚瑜發言完全被稀釋掉，電視辯論反成了可以向選民訴求的最佳機會，所以他抓準了大家已厭倦藍綠惡...,2011-12-19,Apple Daily
談 農 業   3 候 選 人 令 人 失 望 （ 李 武 忠 ）,https://www.appledaily.com.tw/appledaily/article/headline/20111219/33897440/,身為執政者馬總統理應最了解實際農業問題所在，也握有最大的資源可以動手來幫助農民解其所苦。然而我們卻看不到執政者對台灣農業...,2011-12-19,Apple Daily
蘋 論 ： 藍 營 立 委   向 馬 道 歉,https://www.appledaily.com.tw/appledaily/article/headline/20111219/33898010/,那些立委咒罵國際級的大科學家「三七仔、敗類」，當然是情急拚命，粗暴野蠻，也很清楚表現出誰才是敗類。但是國會議員有權力罵人...,2011-12-19,Apple Daily
1 0 萬 小 豬 回 娘 家   拼 台 灣 圖,https://www.appledaily.com.tw/appledaily/article/headline/20111219/33897626/,隨後大小卡車陸續進場，搬運的堆高機也來回穿梭，把沉甸甸小豬一箱箱送進總部裡「開心」、數錢、保存。由於小豬們金額龐大，各縣...,2011-12-19,Apple Daily
蔡 英 文 ： 推 動 綠 能 　 2 0 2 5 走 向 非 核 家 園,https://tw.news.appledaily.com/politics/realtime/20111218/101577/,「英嘉之夜、勞工相挺後援會成立造勢晚會」今天晚上在高雄市舉行，民進黨總統候選人蔡英文與高雄市長陳菊、民進黨高雄市立委參選...,2011-12-18,Apple Daily
蔡 英 文 總 部 前 　 小 豬 排 出 大 台 灣,https://tw.news.appledaily.com/politics/realtime/20111218/101571/,民進黨總統候選人蔡英文競選總部，今天舉辦「1218全國小豬回娘家─公平正義撲滿台灣」活動，板橋競選總部前湧入支持群眾，民...,2011-12-18,Apple Daily
蘇 嘉 全 會 雲 林 鄉 親 ： 當 選 辦 農 博 會,https://tw.news.appledaily.com/politics/realtime/20111218/101570/,民進黨副總統候選人蘇嘉全，今天在台中市參加雲林同鄉會餐會表示，雲林縣是農業大縣，如果民進黨總統候選人蔡英文與他當選，一定...,2011-12-18,Apple Daily
國 際 科 學 家 被 罵 敗 類 　 蔡 問 馬 安 心 嗎,https://tw.news.appledaily.com/politics/realtime/20111218/101545/,民進黨總統候選人蔡英文今天下午出席南台灣體育運動界挺小英造勢大會，在現場表示，國民黨總統候選人馬英九，昨天在辯論時指她卸...,2011-12-18,Apple Daily
宇 昌 案 　 劉 憶 如 擬 周 二 提 問 蔡 英 文,https://tw.news.appledaily.com/politics/realtime/20111218/101538/,"宇昌案風波延燒，經建會主委劉憶如表示，為維護國發基金權益，最快於後天對宇昌前董事長蔡英文提問，希望蔡能說明。

劉憶...",2011-12-18,Apple Daily
三 總 統 候 選 人 齊 聚 高 屏 　 國 安 局 長 親 壓 陣,https://tw.news.appledaily.com/politics/realtime/20111218/101533/,親民黨立委候選人黎建南今天成立競選總部，高雄市警局現場出動特勤中隊荷槍實彈警戒，國安局長蔡得勝也親自壓陣。蔡得勝表示，因...,2011-12-18,Apple Daily
綠 營 黃 金 3 0 天 強 掃 街 　 小 豬 也 有 續 集,https://tw.news.appledaily.com/politics/realtime/20111218/101522/,民進黨總統候選人蔡英文發言人徐佳青今天受訪表示，本月24日以後，各縣市還會有40場大型造勢活動，也會動員黨公職人員到重要...,2011-12-18,Apple Daily
雲 林 綠 營 特 製 大 豬 　 可 裝 入 5 0 0 隻 小 豬,https://tw.news.appledaily.com/politics/realtime/20111218/101521/,民進黨雲林縣黨部，今天將1500隻大、小豬送上總統候選人蔡英文台北競選總部，昨晚工作人員將約500隻小豬餵進訂製大豬裡，...,2011-12-18,Apple Daily
藍 綠 差 僅 剩 1 % ！ 　 綠 ： 2 5 年 來 第 1 次,https://tw.news.appledaily.com/politics/realtime/20111218/101517/,最近多項媒體民調顯示，藍綠兩黨總統候選人馬蔡民調差不到1%，民進黨總統候選人蔡英文發言人徐佳青今天受訪表示，選情一直非常...,2011-12-18,Apple Daily
富 邦 蔡 明 忠 ： 2 0 0 8 年 捐 款 馬 拒 收,https://tw.news.appledaily.com/politics/realtime/20111218/101514/,民進黨總統候選人蔡英文，昨天在總統大選辯論會中，質疑國民黨總繷候選人馬英九「有沒有收受富邦1500萬的政治獻金？」綠營發...,2011-12-18,Apple Daily
萬 隻 小 豬 回 娘 家 　 壯 觀 鋪 成 大 台 灣,https://tw.news.appledaily.com/politics/realtime/20111218/101507/,民進黨總統候選人蔡英文競選總部今天舉辦「1218全國小豬回娘家─公平正義撲滿台灣」活動，目前板橋競選總部前已湧現支持人潮...,2011-12-18,Apple Daily
蔡 喊 溫 暖 　 一 貫 道 林 再 錦 ： 挺 誰 心 裡 有 數,https://tw.news.appledaily.com/politics/realtime/20111218/101506/,民進黨總統候選人蔡英文，今天在高雄上午出席「一貫道慈善功德會」活動，面對萬人的場合，台下頻頻高呼「總統好」與「小英加油」...,2011-12-18,Apple Daily
馬 英 九 批 蔡 英 文 ： 總 統 要 有 更 高 標 準,https://tw.news.appledaily.com/politics/realtime/20111218/101503/,國民黨總統候選人馬英九，今天到新北市新店為同黨立委參選人羅明才造勢，馬英九質疑民進黨總統候選人蔡英文在宇昌案扮演的角色，...,2011-12-18,Apple Daily
民 進 黨 明 告 吳 敦 義 　 被 告 又 多 1 人,https://tw.news.appledaily.com/politics/realtime/20111218/101493/,"民進黨因宇昌案提告的對象再添1人，這回要告的是行政院長吳敦義。

民進黨發言人莊瑞雄今天上午召開記者會，指吳敦義日前...",2011-12-18,Apple Daily
