titles,links,content,time,media
蔡 英 文 掃 街 　 誓 言 為 台 灣 帶 來 幸 福,https://tw.news.appledaily.com/politics/realtime/20120107/104599/,"民進黨總統候選人蔡英文今從故鄉屏東起跑進行車隊掃街，她特別選在背對海洋的東港鎮海公園，做為選前1周全台車隊掃街的起點。
...",2012-01-07,Apple Daily
從 故 鄉 屏 東 出 發 　 蔡 英 文 揚 帆 北 上 掃 街,https://tw.news.appledaily.com/politics/realtime/20120107/104566/,今天是總統大選投票日前的最後一個星期六，民進黨總統候選人蔡英文今天上午選在故鄉屏東出發，和副總統候選人蘇嘉全一起在屏東東...,2012-01-07,Apple Daily
選 前 黃 金 周 末 　 藍 綠 橘 全 台 拼 場,https://tw.news.appledaily.com/politics/realtime/20120107/104559/,"選前最後一個周末，各黨候選人卯足全力拼戰，把握衝刺時機。

國民黨總統候選人馬英九今天從台東出發，夫人周美青也出動掃...",2012-01-07,Apple Daily
誰 來 當 懸 崖 邊 的 守 護 者 （ 陳 文 茜 ）,https://www.appledaily.com.tw/appledaily/article/headline/20120107/33943875/,「十年」！世界經濟再衰弱十年！對我們這種事業已成但生活優渥的人，只是個「投資損失」的壞消息。但對多數芸芸眾生，生活線上掙...,2012-01-07,Apple Daily
「 勝 選 不 全 拿 」 蔡 拋 「 大 聯 合 政 府 」,https://www.appledaily.com.tw/appledaily/article/headline/20120107/33943710/,昨政見會，雙英仍就兩岸政策激烈攻防，馬英九緊咬蔡英文否定九二共識將帶來兩岸關係倒退的嚴重後果，馬指國際環境這麼兇險，還提...,2012-01-07,Apple Daily
陳 致 中 選 情 漲   綠 憂 藍 得 利,https://www.appledaily.com.tw/appledaily/article/headline/20120107/33943698/,高雄市第九選區（前鎮、小港）綠營基本盤逾六成，民進黨提名的郭玟成連任原十拿九穩，不料陳致中投入選戰，讓郭壓力大增，地方人...,2012-01-07,Apple Daily
野 村 ： 藍 營 如 勝 選   台 股 將 短 暫 大 漲,https://www.appledaily.com.tw/appledaily/article/finance/20120107/33942835/,【劉煥彥╱台北報導】野村證券在昨天發表的台灣總統大選特別研究報告中指出，根據國內各家民調結果來看，馬英九應該會驚險贏得連...,2012-01-07,Apple Daily
辣 蘋 果 ： 第 四 組 候 選 人 （ 余 艾 苔 ）,https://www.appledaily.com.tw/appledaily/article/headline/20120107/33943707/,扁接著宣讀祭文，之前北監令扁不可談論選舉議題，但沒有人想到他念的是「另類祭文」，祭文中痛陳司法不公、撇清吳淑珍愛錢，更要...,2012-01-07,Apple Daily
學 者 分 析   選 民 已 有 定 見   不 受 影 響,https://www.appledaily.com.tw/appledaily/article/headline/20120107/33943670/,民進黨高層昨表示，扁此行真情流露，跪拜及與扁媽的擁抱讓人印象深刻，即使為自己官司辯護，也屬人之常情，並無過多的政治動作，...,2012-01-07,Apple Daily
宋 轟 藍 綠 燒 錢 「 廣 告 一 周 砸 2 億 」,https://www.appledaily.com.tw/appledaily/article/headline/20120107/33943720/,宋楚瑜批，政府有錢置入性行銷，藍綠登廣告，輸人不輸陣，變成兩黨面子戰爭，但卻因此讓台灣失掉裡子。蔡英文稍後回應：「我們的...,2012-01-07,Apple Daily
蔡 批 企 業 表 態   馬 ： 製 造 對 立 抹 黑,https://www.appledaily.com.tw/appledaily/article/headline/20120107/33943717/,馬英九指出，台塑企業總裁王文淵對他的員工說，每一個人都應以對自己好為前提，來投下智慧的一票。長榮總裁張榮發也公開支持「九...,2012-01-07,Apple Daily
特 赦 阿 扁   不 是 選 舉 重 點 （ 李 中 志 ）,https://www.appledaily.com.tw/appledaily/article/headline/20120107/33943867/,這幾個巨幅廣告可能要花上百萬，若大字寫的是民進黨的競選主軸，支持者不願曝光，默默地出錢出力，民進黨必會欣然接受，也無涉《...,2012-01-07,Apple Daily
祭 文 訴 冤 「 珍 不 愛 錢 」,https://www.appledaily.com.tw/appledaily/article/headline/20120107/33943673/,扁昨拿著麥克風發表祭文，連被重重警力阻擋在靈堂外的扁迷都聽得一清二楚。儘管已長達3年沒公開演說，但扁講話不看稿的功力未減...,2012-01-07,Apple Daily
理 解 扁 奔 喪 　 蔡 英 文 ： 全 力 挺 郭 玟 成,https://tw.news.appledaily.com/politics/realtime/20120106/104531/,雖然天氣濕冷，民進黨總統候選人蔡英文，冒雨陪同黨新北市立委候選人在五股、泰山、新莊、樹林一帶掃街拜票，雖然冬雨不斷，沿路...,2012-01-06,Apple Daily
馬 ： 我 始 終 如 一 　 蔡 主 席 變 來 變 去,https://tw.news.appledaily.com/politics/realtime/20120106/104529/,在選前最後一場政見會中，國民黨總統候選人馬英九於第二輪發言時表示，民主進步黨總統候選人蔡英文的兩岸政策空洞，至今說不清「...,2012-01-06,Apple Daily
馬 ： 我 始 終 如 一 　 蔡 主 席 變 來 變 去,https://tw.news.appledaily.com/politics/realtime/20120106/104529/,在選前最後一場政見會中，國民黨總統候選人馬英九於第二輪發言時表示，民主進步黨總統候選人蔡英文的兩岸政策空洞，至今說不清「...,2012-01-06,Apple Daily
最 終 政 見 會 　 蔡 英 文 著 眼 兩 岸 論 述,https://tw.news.appledaily.com/politics/realtime/20120106/104524/,在最後一場政見會的第三輪發言中，蔡英文首先針對親民黨主席宋楚瑜先前對民進黨的質疑提出反駁，她強調，所有的競選經費都是小額...,2012-01-06,Apple Daily
馬 強 調 行 政 中 立 　 未 來 關 注 國 民 幸 福 指 數,https://tw.news.appledaily.com/politics/realtime/20120106/104526/,在最後一輪政見發表中，對於蔡英文指控違反行政中立，馬英九駁斥：「這不是事實，這樣的指控，我不能接受。」表示擔任台北市長開...,2012-01-06,Apple Daily
最 終 政 見 會 　 蔡 英 文 強 打 清 廉 牌,https://tw.news.appledaily.com/politics/realtime/20120106/104523/,在最後一場政見會的第二輪發言中，民進黨主席蔡英文首先針對前二輪馬英九總統的發言感到失望，她認為應該把握機會多談願景、多談...,2012-01-06,Apple Daily
最 終 政 見 會 　 蔡 英 文 強 攻 馬 執 政 不 力,https://tw.news.appledaily.com/politics/realtime/20120106/104520/,在最後一場政見發表會的第一輪發言中，民進黨主席蔡英文首先強調，在最後的關頭，民眾應該要把選戰中的文宣、廣告等紛紛擾擾放下...,2012-01-06,Apple Daily
馬 英 九 ： 重 視 教 育 　 批 小 英 抹 黑,https://tw.news.appledaily.com/politics/realtime/20120106/104521/,在今晚第13屆總統候選人電視政見發表會中，抽到第一位上台的是國民黨候選人馬英九，一開始發言便表明，相當重視目前年輕人的教...,2012-01-06,Apple Daily
總 統 候 選 人 電 視 政 見 會 　 八 點 中 視 直 播,https://tw.news.appledaily.com/politics/realtime/20120106/104518/,第三場總統候選人電視政見發表會今天晚上八點舉行，中視現場播出，中選會主委張博雅主持。抽籤發言順序是，一號馬英九，二號宋楚...,2012-01-06,Apple Daily
綠 委 ： 選 民 有 定 見 　 扁 奔 喪 無 傷 選 情,https://tw.news.appledaily.com/politics/realtime/20120106/104487/,針對前總統陳水扁今天早上奔岳母喪對於選情的影響，綠營表日以平常心看待，民進黨立院黨團副書記長陳亭妃說，選舉只剩下七天，選...,2012-01-06,Apple Daily
蔡 英 文 廣 告 「 舔 舌 妹 」 　 自 願 挺 馬 吳,https://tw.news.appledaily.com/politics/realtime/20120106/104457/,"YouTube-蘋果日報 - 20110601 -【短片】正妹「舔舌妹」拍民進黨宣傳片爆紅


總統大選選戰倒數第...",2012-01-06,Apple Daily
藍 委 端 出 紅 蛋 　 批 「 宇 昌 案 」 滿 月,https://tw.news.appledaily.com/politics/realtime/20120106/104453/,國民黨立院黨團，今天推出3支各30秒的馬吳總統競選廣告，分別是「宇昌篇」、「無經驗篇」、「人格篇」，片中以民眾受訪方式，...,2012-01-06,Apple Daily
民 進 黨 1 4 萬 3 千 隻 小 豬 　 募 款 逾 2 億 元,https://tw.news.appledaily.com/politics/realtime/20120106/104444/,民進黨發言人林俊憲今天在「開心小豬、勝利成功」記者會上表示，自去年12月1日發出小豬回娘家的召集令後，至今已有14萬3千...,2012-01-06,Apple Daily
民 進 黨 1 4 萬 3 千 隻 小 豬 　 募 款 逾 2 億 元,https://tw.news.appledaily.com/politics/realtime/20120106/104444/,民進黨發言人林俊憲今天在「開心小豬、勝利成功」記者會上表示，自去年12月1日發出小豬回娘家的召集令後，至今已有14萬3千...,2012-01-06,Apple Daily
總 統 最 終 政 見 會 　 蔡 馬 宋 今 晚 8 時 再 交 鋒,https://tw.news.appledaily.com/politics/realtime/20120106/104437/,"中選會舉辦的最後一場總統電視政見會將在今晚8時登場，3黨總統候選人都全力備戰，把握最後機會。

民進黨發言人陳其邁表...",2012-01-06,Apple Daily
邱 毅 譏 扁 可 悲 　 只 能 玩 悲 情 牌,https://tw.news.appledaily.com/politics/realtime/20120106/104433/,前總統陳水扁今天奔喪，國民黨立委邱毅今天表示，扁跪爬進靈堂是孝道表現，但隨後發表的祭文太煽情，批扁說沒貪污是「睜眼說瞎話...,2012-01-06,Apple Daily
4 0 0 台 商 挺 蔡   嗆 「 老 馬 回 家 」,https://www.appledaily.com.tw/appledaily/article/headline/20120106/33940964/,而蔡瀛如和蔡英文年紀最接近，兩星期前已自美返台，但很低調，她說，家人個性都如此，不想曝光，不會公開助選，但私下會跑一些朋...,2012-01-06,Apple Daily
「 防 異 交 」 「 學 英 文 」   創 意 看 板 藏 玄 機,https://www.appledaily.com.tw/appledaily/article/headline/20120106/33940511/,除候選人外，一家線上英語課程業者日前在蔡英文中市競選總部旁架大型看板，貌似馬總統的「西裝男」，臉部被「我要學英文」五面字...,2012-01-06,Apple Daily
美 青 玩 布 袋 戲   笑 馬 像 史 豔 文,https://www.appledaily.com.tw/appledaily/article/headline/20120106/33940960/,"輔選人士說，綠營大票倉民眾的熱情，明顯不如其他縣市，充分反映馬吳配在嘉南的艱困選情。
馬英九昨一早先到嘉義縣新港奉天宮上...",2012-01-06,Apple Daily
黃 金 周 末   藍 綠 1 5 萬 人 鬧 台 北,https://www.appledaily.com.tw/appledaily/article/headline/20120106/33940951/,不過，民進黨昨引用《壹週刊》報導，在媒體刊登「馬吳違法下令公務員遊行」廣告；民進黨團幹事長蔡煌瑯也開記者會，出示來自公股...,2012-01-06,Apple Daily
投 票 倒 數 　 蔡 英 文 催 僑 胞 票,https://tw.news.appledaily.com/politics/realtime/20120105/104290/,民進黨總統候選人蔡英文今天上午在板橋競選總部，進行「海外團結力挺英嘉」記者會，不少海外僑胞湧入，蔡英文興奮地說，得知有南...,2012-01-05,Apple Daily
蘋 論 ： 為 選 舉 高 唱 空 城 計,https://www.appledaily.com.tw/appledaily/article/headline/20120105/33937698/,據本期《壹週刊》報導，馬吳全國競選總部要求內政部、財政部、經濟部、教育部、交通部、勞委會、農委會、退輔會等8大部會，動員...,2012-01-05,Apple Daily
陳 致 中   郭 玟 成   隔 街 爭 嗆 馬,https://www.appledaily.com.tw/appledaily/article/headline/20120105/33937681/,郭玟成率領的支持者先佔住夜市入口左側 ，高喊「馬英九下台」，陳致中則隔著一條馬路，站在宣傳車上，用擴音器大喊「馬英九下台...,2012-01-05,Apple Daily
司 馬 觀 點 ： 奔 喪 政 治 （ 江 春 男 ）,https://www.appledaily.com.tw/appledaily/article/headline/20120105/33937701/,"其實，阿扁奔喪，對蔡英文不會有影響，真正受衝擊的是陳致中選情，但萬一處理不當，對國民黨選情也有副作用。
前總統戴手銬腳鐐...",2012-01-05,Apple Daily
扒 手 隨 蔡 一 路 偷   被 逮 稱 「 同 業 」 有 3 0 人,https://www.appledaily.com.tw/appledaily/article/headline/20120105/33937694/,警方調查，扒手李慶賢（60歲）、林源村（52歲），聲稱蔡英文的維安人員較少，支持者又熱情，常跟著小英全台跑，裝成支持者，...,2012-01-05,Apple Daily
「 九 二 共 識 」 與 「 台 灣 共 識 」 共 存 （ 林 震 岩 ）,https://www.appledaily.com.tw/appledaily/article/headline/20120105/33938438/,近日長榮集團總裁發出「台灣共識就是台獨」的看法，自從民進黨蔡英文提出將以台灣共識來取代九二共識，造成兩岸未來的不確定性增...,2012-01-05,Apple Daily
簡 余 晏 v s . 羅 淑 蕾   粉 紅 旗 海 大 戰,https://www.appledaily.com.tw/appledaily/article/headline/20120105/33937704/,王瑄昨騎馬率支持者車隊到城隍廟上香，也到鬧區、市場掃街拜票，吸引民眾目光，一名路過騎士高喊：「妳是竹科那個王瑄喔，加油，...,2012-01-05,Apple Daily
德 意 志 ： 台 股 本 季 恐 測 6 4 0 0,https://www.appledaily.com.tw/appledaily/article/finance/20120105/33937224/,台股昨日因國安基金進場護盤，小漲29.59點，以7082.97點作收，力守7000點關卡。由於下周六即是總統大選，選前民...,2012-01-05,Apple Daily
民 進 黨 選 情 膠 著 中 突 圍 之 道 （ 林 濁 水 ）,https://www.appledaily.com.tw/appledaily/article/headline/20120105/33938442/,柿子、陳盈助、農舍、宇昌、國安會非法監控等零碎案子成為選戰中最激情的議題，雖令人感嘆選舉品質低落，但一連串的交鋒也使民眾...,2012-01-05,Apple Daily
批 財 團 挺 馬 　 蔡 英 文 ： 企 業 老 闆 基 於 無 奈,https://tw.news.appledaily.com/politics/realtime/20120104/104200/,民進黨總統候選人蔡英文今天赴宜蘭縣，走訪南方澳進安宮和南天宮拜拜，支持群眾瘋狂搶握手，沿路「總統好」、「蔡英文凍蒜」聲音...,2012-01-04,Apple Daily
綠 提 新 證 據 　 蔡 英 文 蘇 貞 昌 去 年 已 遭 監 控,https://tw.news.appledaily.com/politics/realtime/20120104/104171/,民進黨發言人莊瑞雄、陳其邁今天上午出示一份檢舉資料，證實去年3月份民進黨初選時，調查局即已開始情蒐。該資料來自調查局內部...,2012-01-04,Apple Daily
宋 楚 瑜 批 馬 英 九 　 沒 有 維 護 台 商 基 本 利 益,https://tw.news.appledaily.com/politics/realtime/20120104/104169/,長榮集團總裁張榮發昨天表態挺「九二共識」，親民黨總統候選人宋楚瑜今天上午受訪說，他也認為「九二共識」是穩定兩岸大家需要思...,2012-01-04,Apple Daily
仿 遶 境 貼 封 條 　 預 告 蔡 英 文 遊 街 路 線,https://tw.news.appledaily.com/politics/realtime/20120104/104162/,民進黨總統候選人蔡英文本月9日將與雲林立委候選人李進勇、劉建國車隊掃街，將從虎尾出發，路線預計行經斗南到斗六，最後到斗南...,2012-01-04,Apple Daily
周 美 青 市 場 握 遍 雙 手 　 被 迫 買 藍 色 圍 巾,https://tw.news.appledaily.com/politics/realtime/20120104/104164/,國民黨總統候選人馬英九夫人周美青，今天到南投縣最熱鬧的南投市場拜票，見到採買民眾或店家逢人就握，幾乎沒有錯過任何一雙手，...,2012-01-04,Apple Daily
蔡 英 文 廣 告 名 導 操 刀 　 訴 求 「 站 在 屋 頂 看 國 家 」,https://tw.news.appledaily.com/politics/realtime/20120104/104158/,民進黨總統候選人蔡英文競選辦公室，今天舉行記者會，公佈晚間將在各新聞台聯播的「屋頂篇」廣告，在長達兩分鐘的廣告中，透過在...,2012-01-04,Apple Daily
張 榮 發 挺 九 二 　 謝 長 廷 ： 體 貼 在 中 國 的 企 業 家,https://tw.news.appledaily.com/politics/realtime/20120104/104132/,針對長榮集團總裁張榮發昨稱「不挺藍綠，只挺九二共識」的發言，民進黨總統候選人蔡英文的競選總指揮謝長廷今天表示，「要體貼在...,2012-01-04,Apple Daily
司 馬 觀 點 ： 蔡 英 文 的 最 後 一 里 路 （ 江 春 男 ）,https://www.appledaily.com.tw/appledaily/article/headline/20120104/33934885/,亞洲各國包括菲律賓、泰國、印度、斯里蘭卡、巴基斯坦都有女人當家的紀錄，韓國明年也有可能選出女總統，但是這些女性領袖都出身...,2012-01-04,Apple Daily
拒 見 蔡   張 榮 發 挺 九 二 共 識,https://www.appledaily.com.tw/appledaily/article/headline/20120104/33934592/,張榮發昨與媒體記者茶敘，首度針對總統候選人政見發表看法。張直言：「聽到有候選人說沒有九二共識，實在忍不住了。」他認為，九...,2012-01-04,Apple Daily
施 造 勢   自 嘲 民 主 靈 車,https://www.appledaily.com.tw/appledaily/article/headline/20120104/33934630/,"親民黨發言人吳崑玉說，宋楚瑜當然選真的，施的說法代表他也支持宋，「用另一個角度幫我們的忙，更能堅定基層支持者的意志。」
...",2012-01-04,Apple Daily
搶 進 國 會   藍 5 縣 市 鬧 內 訌,https://www.appledaily.com.tw/appledaily/article/headline/20120104/33934624/,中選會公告，全國共有410人角逐113席立委，除34席不分區立委外，區域及原住民立委應選79席，共有283人參選，其中國...,2012-01-04,Apple Daily
「 拆 除 恐 龍 法 官 溫 床 」,https://www.appledaily.com.tw/appledaily/article/headline/20120104/33934865/,林孟皇說，最高法院的改革已到刻不容緩程度，除恐龍法官爭議，去年最高院法官蕭仰歸為子關說，最高院竟決議認定沒關說，讓全體法...,2012-01-04,Apple Daily
馬 嫂 拜 票   3 度 遇 嗆,https://www.appledaily.com.tw/appledaily/article/headline/20120104/33934600/,周美青昨到彰化地區拜票，雖然數度遭嗆，但仍維持「美青式風格」，一路握手與九十度深深鞠躬，比起前一天，神情略顯輕鬆，一掃「...,2012-01-04,Apple Daily
蔡 英 文 新 廣 告 　 「 女 人 當 家 」 吳 念 真 製 作,https://tw.news.appledaily.com/politics/realtime/20120103/104052/,"YouTube-女人當家-蔡英文 


台灣知名導演吳念真，幫民進黨總統候選人蔡英文製作的一支名為「女人當家」的競...",2012-01-03,Apple Daily
T V B S 封 關 民 調 　 馬 英 九 蔡 英 文 差 8 %,https://tw.news.appledaily.com/politics/realtime/20120103/104039/,根據今晚TVBS政論節目「2100全民開講」在節目中顯示，TVBS封關民調中，馬蔡差8%，如果明天投票，國民黨總統候選人...,2012-01-03,Apple Daily
旺 旺 中 時 終 極 民 調 　 馬 英 九 贏 蔡 英 文 3 百 分 點,https://tw.news.appledaily.com/politics/realtime/20120103/103998/,今天是總統大選前民調公布的最後一天，根據「旺旺」《中時》的「終極民調」，三組支持率分別是馬吳配39.5%、英嘉配36.5...,2012-01-03,Apple Daily
最 後 民 調 大 不 同 　 藍 ： 馬 贏 1 0 點 　 綠 ： 蔡 贏 1 點,https://tw.news.appledaily.com/politics/realtime/20120103/103997/,"
 
 
今天是總統大選前民調公布的最後日期，民進黨上午公布最後一次民調結果，指民進黨總統候選...",2012-01-03,Apple Daily
周 美 青 拉 票 　 工 業 區 歡 迎 天 后 宮 被 嗆,https://tw.news.appledaily.com/politics/realtime/20120103/103994/,國民黨總統候選人馬英九夫人周美青，今天中午到彰化花壇全興工業區拉票，員工包圍周美青，握手、拍照、簽名樣樣來，小型簽名會排...,2012-01-03,Apple Daily
談 扁 奔 喪 　 呂 秀 蓮 籲 人 道 考 量,https://tw.news.appledaily.com/politics/realtime/20120103/103988/,前副總統呂秀蓮今到民進黨正副總統候選人蔡英文、蘇嘉全大台中市區競選總部，舉行記者會，談319槍擊案，但媒體聚焦在前總統陳...,2012-01-03,Apple Daily
求 見 張 榮 發 遭 拒 ？ 　 蔡 英 文 ： 搞 錯 了 吧 ？,https://tw.news.appledaily.com/politics/realtime/20120103/103991/,針對長榮集團總裁張榮發說，民進黨總統候選人蔡英文也曾希望來拜會他，但他拒絕了，並指「台灣共識」是談「台獨」，他不認同。對...,2012-01-03,Apple Daily
社 論 「 選 宋 就 是 選 蔡 」 　 親 民 黨 按 鈴 告 《 聯 合 報 》,https://tw.news.appledaily.com/politics/realtime/20120103/103984/,針對《聯合報》昨天社論標題「選宋楚瑜就是選蔡英文」，親民黨發言人吳崑玉與委任律師陳鄭權，今天下午舉行記者會，吳崑玉痛批，...,2012-01-03,Apple Daily
「 團 隊 多 人 涉 案 起 訴 」 　 藍 委 批 蔡 英 文 標 準 低,https://tw.news.appledaily.com/politics/realtime/20120103/103982/,"國民黨立院黨團今天舉行記者會，藍委徐少萍質疑，民進黨總統候選人蔡英文團隊，有多人涉案遭起訴，清廉度受質疑。
 ...",2012-01-03,Apple Daily
蔡 英 文 總 部 旁 槍 響 　 餐 廳 遭 鋼 珠 射 6 槍,https://tw.news.appledaily.com/local/realtime/20120103/103978/,花蓮市商校街1家素食餐廳，今天早上發現店門口玻璃門被人以鋼珠彈射6槍打破，且餐廳就在蔡英文及立委賴坤成聯合競選總部旁不到...,2012-01-03,Apple Daily
蔡 英 文 總 部 旁 槍 響 　 餐 廳 遭 鋼 珠 射 6 槍,https://tw.news.appledaily.com/local/realtime/20120103/103978/,花蓮市商校街1家素食餐廳，今天早上發現店門口玻璃門被人以鋼珠彈射6槍打破，且餐廳就在蔡英文及立委賴坤成聯合競選總部旁不到...,2012-01-03,Apple Daily
駁 情 蒐 蔡 英 文 　 吳 敦 義 「 有 就 退 選 」,https://tw.news.appledaily.com/politics/realtime/20120103/103976/,國民黨副總統候選人吳敦義，今天上午在台中新社、外埔、東市農會拜票，持續火力批民進黨總統候選人蔡英文。吳敦義說，蔡英文對拜...,2012-01-03,Apple Daily
蔡 英 文 樂 觀 贏 面 大 　 「 但 要 非 常 努 力 」,https://tw.news.appledaily.com/politics/realtime/20120103/103970/,民進黨總統候選人蔡英文，今天上午在彰化、南投一帶地毯式掃街，蔡英文說，「我們勝算是蠻大的」，但是最重要的是要催票，她強調...,2012-01-03,Apple Daily
張 榮 發 挺 九 二 共 識 　 拒 蔡 英 文 拜 會,https://tw.news.appledaily.com/politics/realtime/20120103/103963/,長榮集團總裁張榮發今天表示，他不挺藍也不挺綠，只挺九二共識，有了九二共識，兩岸才有對話基礎，為了台灣經濟發展、社會安定，...,2012-01-03,Apple Daily
蘇 嘉 全 台 中 掃 街 　 低 調 不 搶 蔡 英 文 鋒 頭,https://tw.news.appledaily.com/politics/realtime/20120103/103958/,民進黨副總統候選人蘇嘉全，今天再度到台中，早上陪同同黨立委候選人李順涼掃街，由於烏日、霧峰、大里等地幅員遼闊，蘇嘉全兩個...,2012-01-03,Apple Daily
蔡 英 文 周 美 青 　 彰 化 同 搶 票,https://tw.news.appledaily.com/politics/realtime/20120103/103920/,民進黨總統候選人蔡英文今天前進彰化，陪同黨籍立委候選人江昭儀、魏明谷車隊，在彰化溪洲、北斗、田尾和員林及南投一帶，以車隊...,2012-01-03,Apple Daily
珍 媽 過 世 　 蘇 嘉 全 今 赴 靈 前 致 意,https://tw.news.appledaily.com/politics/realtime/20120103/103898/,前總統夫人吳淑珍的母親吳王霞日前病逝，民進黨副總統候選人蘇嘉全今天上午9時赴靈堂上香致意。蘇嘉全說，主席蔡英文昨指示，要...,2012-01-03,Apple Daily
珍 媽 出 殯 　 蔡 英 文 不 出 席,https://tw.news.appledaily.com/politics/realtime/20120103/103874/,前總統陳水扁的岳母吳王霞日前過世，將在下周二舉行告別式，扁今將透過北市議員江志銘聲請奔喪，民進黨總統候選人蔡英文昨決定不...,2012-01-03,Apple Daily
沒 甚 麼 不 一 樣 （ 張 大 春 ）,https://www.appledaily.com.tw/appledaily/article/headline/20120103/33932544/,這樣的悵惘不甘，使得馬英九很難用同樣的邏輯抗辯：「站在你面前的是馬英九，不是蔣介石。」換言之：半世紀專政所留下的包袱看來...,2012-01-03,Apple Daily
辣 蘋 果 專 欄 ： 小 英 終 切 割 扁 （ 余 艾 苔 ）,https://www.appledaily.com.tw/appledaily/article/headline/20120103/33932812/,對蔡英文而言，她能閃則閃，但是這一次迫在眉睫的阿扁奔喪，小英若再迴避，就顯得她取巧，所以她毅然做出不去弔唁的重大決定，雖...,2012-01-03,Apple Daily
司 馬 觀 點 ： 為 民 主 致 哀 （ 江 春 男 ）,https://www.appledaily.com.tw/appledaily/article/headline/20120103/33932848/,選前發生意外事件，因而扭轉結果的例子很多。不過，預期會發生的事，就不是意外事件。可怕的颱風都在意料之外，阿扁奔喪是可預見...,2012-01-03,Apple Daily
林 再 提 電 磁 波   指 政 府 租 屋 監 控,https://www.appledaily.com.tw/appledaily/article/headline/20120103/33932834/,林瑞雄昨說他9月20日宣布擔任宋的副手，下午國安局和警察局就來要他居住大樓的平面圖，並在他家後面租了30人別墅。他說「電...,2012-01-03,Apple Daily
