titles,link,article,time,media
蔡遭監控 前員山鄉代告馬英九等,https://news.ltn.com.tw/news/politics/paper/551069,"黨總統候選人蔡英文遭調查局監控，前宜蘭縣員山鄉民代表林錦坤昨將刑事告發狀寄到特偵組告發總統馬英九、國安會秘書長胡為真、調查局長張濟平及基層調查官二十八人涉嫌違反正副總統選舉罷免法及圖利罪。
告發狀指出...",<generator object <genexpr> at 0x119e1a8b8>,Liberal Times
執政3年多 研考會統計／馬政見已完成率 僅43.9％,https://news.ltn.com.tw/news/politics/paper/551067,〔記者黃維助／台北報導〕總統馬英九執政已三年多，研考會日前統計至一百年十月底止，馬英九前次競選所提政見中，「已完成」政見僅四十三．九％。等於馬的任期已過了五分之四，政見「已完成率」卻未達一半，政...,<generator object <genexpr> at 0x119e1a930>,Liberal Times
副手政見會今登場 蘇吳林備戰,https://news.ltn.com.tw/news/politics/paper/551065,"候選人公辦政見發表會今晚八時登場，由民視進行轉播，民進黨候選人蘇嘉全將鎖定民生議題並將檢驗馬英九施政，國民黨候選人吳敦義則主攻政績，親民黨候選人林瑞雄昨天一派輕鬆說︰「兵來將擋，水來土掩。」
蘇嘉全闡...",<generator object <genexpr> at 0x119e1a9a8>,Liberal Times
梨山升旗談話 馬再提2元柿,https://news.ltn.com.tw/news/local/paper/551016,"〔記者張瑞楨／梨山報導〕台中市海拔最高的和平區梨山，今天首度舉辦升旗典禮，並播放馬英九對中市市民的談話，不過，馬英九文告再度提到「兩元甜柿謠言」，並指該謠言導致和平與東勢果價跌得很厲害。
民進...",<generator object <genexpr> at 0x119e1aa20>,Liberal Times
馬吳客家文宣 融入大富翁遊戲,https://news.ltn.com.tw/news/local/paper/551015,"後衝刺，馬吳中部辦公室昨天推出創意十足的「客家上菜」大富翁文宣，兼具政策宣導及遊戲功能；而馬英九也將在本月八日到台中市進行遊行、掃街造勢，拉抬台中的選情。
馬吳中部辦公室發言人唐國泰表示，這份文宣一共...",<generator object <genexpr> at 0x119e1aa98>,Liberal Times
中台禪寺祈福 惟覺:三願三不願,https://news.ltn.com.tw/news/local/paper/551006,"縣埔里鎮中台禪寺舉辦「海峽兩岸和平祈福法會」，現場充滿濃濃選戰氣息，除了縣長李朝卿力挺總統馬英九外，中台禪寺開山方丈釋惟覺也主張「三願三不願」。
法會由中台禪寺與對岸中國佛教協會等聯合舉辦，現場信眾同...",<generator object <genexpr> at 0x119e1ab10>,Liberal Times
金烈「浮橋」 三月開標,https://news.ltn.com.tw/news/life/paper/550970,"有11家廠商到場。
金烈大橋工程被金門人戲稱為「浮橋」，諷刺它總在選舉前才浮出檯面。總統馬英九去年1月9日主持過動土典禮，去年12月19日抵金門時還宣布大橋施工需要的海上機械租用問題已解決。...",<generator object <genexpr> at 0x119e1ab88>,Liberal Times
矛盾不公 前任總座朱澤民痛批 二代健保如怪胎,https://news.ltn.com.tw/news/life/paper/550956,"大，收入高的醫師、會計師不用繳補充保費，辛苦兼差的一般人卻要繳，職業有分貴賤嗎？這些問題，馬英九總統卻都沒看到，一直將二代健保視為改革政績，令人匪夷所思。
其次，衛生署及健保局都在觀望，總統大選結果將...",<generator object <genexpr> at 0x119e1ac00>,Liberal Times
總統大選》馬英九元旦祝詞　綠批「騙選票」,https://news.ltn.com.tw/news/politics/breakingnews/587362,)日是中華民國101年元旦，距總統大選倒數2週，雙英各自針對國家未來方向發表元旦談話，總統馬英九元旦祝詞以「為下個世代點亮蠟燭」為題，強調現在所做的一切，都將決定未來歷史，民進黨立院黨團幹事長蔡煌瑯痛批...,<generator object <genexpr> at 0x119e1ac78>,Liberal Times
總統大選》台灣智庫民調　綠營選票團結,https://news.ltn.com.tw/news/politics/breakingnews/587354,〔即時新聞／綜合報導〕總統大選倒數12天，台灣智庫今天公佈民調，在總統候選人支持度方面，馬英九38.8％，僅以1個百分點小幅領先蔡英文的37.8％；但在「一定會去投票的民眾」當中，蔡英文以42.1％領先...,<generator object <genexpr> at 0x119d49a20>,Liberal Times
周美青腰傷復發？　總統府：無大礙,https://news.ltn.com.tw/news/life/breakingnews/587344,"也沒就診，應只是一般的傷痛腰痛；總統府表示，周美青腰傷沒有大礙。

　周美青今日和總統馬英九一同參加總統府前升旗典禮，典禮結束後，周美青和馬英九走入人群和民眾握手，疑似為了和站在較後方的民眾...",<generator object <genexpr> at 0x119ee5b10>,Liberal Times
總統大選》元旦談話　雙英互別苗頭,https://news.ltn.com.tw/news/politics/breakingnews/587325,〔即時新聞／綜合報導〕總統大選進入倒數2週，總統馬英九、民進黨總統候選人蔡英文今(1)日各自發表元旦談話，煙硝味濃厚。蔡英文表示，邀請民眾站出來，和蔡英文一起共同把對政府的信賴找回來；馬英九則表...,<generator object <genexpr> at 0x119ee5b88>,Liberal Times
總統升旗典禮致詞　民眾掉頭離去,https://news.ltn.com.tw/news/politics/breakingnews/587252,新聞／綜合報導〕民國101年元旦升旗典禮，今天清晨在總統府前廣場舉行，當現場唱完國歌，總統馬英九準備上台致詞時，許多民眾紛紛離開，讓現場氣氛有些尷尬，而馬英九後來走進人群，與大家握手致意。有網友...,<generator object <genexpr> at 0x119ee5c00>,Liberal Times
總統大選》蘇貞昌籲政府中立並抓賄,https://news.ltn.com.tw/news/politics/breakingnews/587173,"蔡英文競選總部特別安排新年第一棒，由蘇貞昌代表總部召開記者會，他暗批政府機關不中立，片面為馬英九競選連任進行宣傳意味濃厚。

蘇貞昌表示，投票倒數第14天，這已經是台灣總統直選的第5次，是人民最高意...",<generator object <genexpr> at 0x119ee5c78>,Liberal Times
梨山升旗文告　馬英九難忘2元甜柿,https://news.ltn.com.tw/news/politics/breakingnews/587141,〔記者張瑞楨／梨山報導〕中市海拔最高的和平區梨山，今天舉辦首度的升旗典禮，並播放總統馬英九對中市市民的談話，不過，馬英九似乎因選舉因素，難忘民進黨2元柿子的文宣，繼1個多星期夜宿東勢果農住處時，...,<generator object <genexpr> at 0x119ee5cf0>,Liberal Times
用選票討公義！,https://news.ltn.com.tw/news/opinion/paper/550948,"二○一一年、二○一二年的總統大選選戰，「三隻小豬對抗大怪獸」形成一股強大風潮，喚起被國民黨馬英九政府壓抑的台灣意識，台灣是我們的國，我們的家，當家作主的當然是「我們」人民這一國，不是「他們」那一國。
...",<generator object <genexpr> at 0x119ee5d68>,Liberal Times
《星期專論》除舊佈新 總統換新,https://news.ltn.com.tw/news/business/paper/550935,"去十年是最高峰，今後成長只低不高；領先指標的台股跌幅慘烈，就是經濟鎖進中國的惡果顯現。
馬英九主政下的台灣，經濟表現鴉鴉烏，政治清明度也不堪。泛藍長期掌控的立法院被列為世界最爛的國會之一，「經濟學人」...",<generator object <genexpr> at 0x119ee5de0>,Liberal Times
馬元旦文告：為下個世代點亮蠟燭,https://news.ltn.com.tw/news/focus/paper/550904,"〔記者彭顯鈞／台北報導〕馬英九總統今天將發表元旦文告，以「為下個世代點亮蠟燭」為主題，強調讓一百年來中華民國自由、民主、正義、文明、慈悲的燭火，持續在下一代發光發亮。
馬總統今天清晨六點半將先在總統府...",<generator object <genexpr> at 0x119ee5e58>,Liberal Times
《跨年夜》馬偕夫人 倒數計時,https://news.ltn.com.tw/news/focus/paper/550903,"前就簽下器捐卡。馬並在安寧醫療的Ｔ恤上簽名，贊同預立安寧緩和醫療意願書，拒絕無效急救。
馬英九昨天下午南下高雄市，在旗山、岡山、路竹、湖內等地進行掃街拜票。
昨晚七點，馬趕到台南參加由文建會指導、明...",<generator object <genexpr> at 0x119ee5ed0>,Liberal Times
公正選舉會 籲司法調查監控小英案,https://news.ltn.com.tw/news/focus/paper/550900,培指出，週刊報導調查局有廿八位調查員負責監視蔡英文，事情還牽連到國安會，這是非常嚴重的事；馬英九聲明不知此事，調查局聲稱是為了國安、維安，報導中出現的文件，至今則未見任何人否認，但知道拔樁會影響馬英...,<generator object <genexpr> at 0x119ee5f48>,Liberal Times
〈李筱峰專欄〉性別‧謊言‧好人‧敗類,https://news.ltn.com.tw/news/opinion/paper/550897,"夠白目，竟然說泰國選出女總統就淹大水，叫我們不能選女總統。」
「你沒聽懂，白冰冰是在暗示馬英九是女性，因為馬英九當總統，台灣也發生慘重的八八水災。」
「台灣已經可以接受女性領導人，我們推出個...",<generator object <genexpr> at 0x119eec048>,Liberal Times
客家精神比一比,https://news.ltn.com.tw/news/opinion/paper/550896,"兩週，馬、蔡選情膠著，決戰落在桃竹苗的三百萬客家選票。
蔡英文早就用客家妹當總統做訴求，馬英九最近喊他是「第一個客家總統」，網路上頗多質疑與揶揄。這位出生地不嫌多、四年前席捲客家選票，如今竟然要靠他生...",<generator object <genexpr> at 0x119eec0c0>,Liberal Times
中國，是台灣經濟的黑洞 從經濟發展史談北美台教會「從ECFA透視台灣危機」,https://news.ltn.com.tw/news/opinion/paper/550894,"
台灣若和相對較落後的中國結合在一起，在清代、一九四五與一九四九，和一九九○年之後特別是馬英九時代，經濟成長都比較差，人民也受到更差的待遇。為何和中國結合，台灣就會比較差呢？我們從兩德合併就可以看出端...",<generator object <genexpr> at 0x119eec138>,Liberal Times
2011台灣年度漢字,https://news.ltn.com.tw/news/opinion/paper/550892,"、白白花錢投票，因此同年台灣大學ＰＴＴ（批踢踢）八卦板開始舉辦代表字票選，前三名分別是象徵馬英九一意孤行不顧民意的「騜」、總統不當，降格當區長的「驅」，以及馬加扁等於「騙」這三個字。 
今年，媒體選出...",<generator object <genexpr> at 0x119eec1b0>,Liberal Times
請用小朋友的眼睛看煙火,https://news.ltn.com.tw/news/opinion/paper/550890,"兒童的就學補助，提供各類博物館、遊樂設施免費入場，增加免費社區才藝課程，來得更實際。但總統馬英九將參加台北市政府前第九次跨年倒數煙火秀，為了拚選票，孩子的意見甩都不甩。
政府努力把跨年人數逐年推升，從...",<generator object <genexpr> at 0x119fbb048>,Liberal Times
連線高呼馬凍蒜 台中跨年晚會 變造勢大會？,https://news.ltn.com.tw/news/politics/paper/550876,"引發行政不中立疑慮！晚會邀請馬總統在體育場與人在梨山的市長胡志強連線，梨山連線現場卻高呼「馬英九凍蒜」。不過，胡志強聲稱，他沒有喊口號，民眾與民代的行為，他無法阻擋。
昨天晚間八時卅分，胡志強在梨山一...",<generator object <genexpr> at 0x119fbb0c0>,Liberal Times
選舉民調 4日起禁公布,https://news.ltn.com.tw/news/politics/paper/550875,"帶，過去從未處理過，若未來有相關案例，將視個案裁定。
過去違反相關規定的案例層出不窮，連馬英九總統本人也曾遭裁罰。二○○九年縣市長選舉，馬英九於十一月廿五日在宜蘭舉辦的行動中常會，直接引述民調...",<generator object <genexpr> at 0x119fbb138>,Liberal Times
林瑞雄掃街 籲馬應知恥下台,https://news.ltn.com.tw/news/politics/paper/550873,"昨天到新北市淡水老街徒步拜票，他表示，台灣近幾年來發展遠遠落後中國，要換個有能力的領導人，馬英九總統無能，應該「知恥近乎勇」，現在下台，還能保有歷史地位。
林瑞雄表示，他發現很多台灣人很苦，經濟越來越...",<generator object <genexpr> at 0x119fbb1b0>,Liberal Times
蘇嘉全祈神 除舊迎新換總統,https://news.ltn.com.tw/news/politics/paper/550872,"
蘇嘉全昨為桃園縣立委候選人鄭文燦助陣，也籲請選民「除舊迎新」，在新的一年換掉執政無能的馬英九，迎接更有能力持家的台灣第一位女總統蔡英文。
蘇嘉全火力全開砲轟馬政府執政無能，讓台灣的民主、經濟「倒退...",<generator object <genexpr> at 0x119fbb228>,Liberal Times
宋搶農民票 籲換掉無能總統,https://news.ltn.com.tw/news/politics/paper/550871,"台灣到底怎麼辦？
宋楚瑜批評，「走了一個謀財的（指前總統陳水扁），來了一個害命的（指總統馬英九）」，大甲溪裡堆滿石頭，全國各地河流沒有好好整治，洪水一來百姓沒命，無能的總統應該換掉，讓會做事的「宋省長...",<generator object <genexpr> at 0x119fbb2a0>,Liberal Times
蔡爭取支持︰2012台灣不能再倒退,https://news.ltn.com.tw/news/politics/paper/550870,"台灣往前走或是倒退 ；台灣過去已倒退三年多，不能再倒退下去。林瑞雄肯定宋楚瑜有情有義，強調馬英九不會連任。
活動主持人、台南市議員王定宇說，這不是選舉造勢場合，對所有候選人都一視同仁，所以對兩人只喊加...",<generator object <genexpr> at 0x119fbb318>,Liberal Times
「水門案」銬馬英九,https://news.ltn.com.tw/news/opinion/paper/550853,"會攘奪國安局的職權，把手伸入調查局，調查局又下令調查員刺探蔡英文選票的分布與進出，自是為了馬英九；不要忘記國安會所聽命的一人就是馬英九。馬英九不是「水門案」中的尼克森是誰？
調查局違法...",<generator object <genexpr> at 0x119fbb390>,Liberal Times
《跨年選味濃》20萬人互道新年快樂,https://news.ltn.com.tw/news/local/paper/550841,"記者李容萍／桃園報導〕桃園跨年晚會昨晚在桃園縣多功能藝文園區登場，超過十六組藝人輪番演出，馬英九總統晚上十點多到場，祝福桃園民眾新年快樂，為今年的跨年增添濃濃選舉味。
馬英九晚上十點卅分在桃園...",<generator object <genexpr> at 0x119fbb408>,Liberal Times
轉動台灣 72919人共創「騎」蹟,https://news.ltn.com.tw/news/life/paper/550761,政治炒作，文建會主委曾志朗前天就表明拒絕任何政治性的宣傳，因此，時常參加建百各種活動的總統馬英九及行政院長吳敦義，昨天反而缺席了「轉動台灣向前行」活動，由副總統蕭萬長、文建會主委曾志朗、體委會主委戴遐齡...,<generator object <genexpr> at 0x119fbb480>,Liberal Times
2012跨年》晚會造勢　蔡馬固守主場、宋與民祈福,https://news.ltn.com.tw/news/politics/breakingnews/587080,"分別在全台各地的跨年晚會造勢催票，民進黨總統候選人蔡英文回防南部鞏固選票，國民黨總統候選人馬英九則在台中固票，藍綠不約而同選擇「回到主場」拉抬選情。

　親民黨主席宋楚瑜則前往台中東勢參加跨年晚會，...",<generator object <genexpr> at 0x119fbb4f8>,Liberal Times
總統大選》桃園造勢　蘇嘉全籲除舊迎新換總統,https://news.ltn.com.tw/news/politics/breakingnews/586977,"值民國百年最後一天，明天就是新的一年，他籲請選民一起「除舊迎新」，在新的一年換掉執政無能的馬英九，迎接更更有能力持家的台灣第一個女總統蔡英文。

寒風中，蘇嘉全感謝桃園鄉親熱情相挺，接著火力全開砲轟...",<generator object <genexpr> at 0x119fbb570>,Liberal Times
今日各報重點新聞一覽,https://news.ltn.com.tw/news/politics/breakingnews/586806,視政見會昨晚登場，三位候選人就國安會情蒐監控案、兩岸與清廉等議題交鋒。民進黨蔡英文要國民黨馬英九說明調查局維安情蒐何時開始、馬團隊是否看過情蒐報告？馬則強調從未如此指示國安單位，反擊蔡英文「又來了，胡亂...,<generator object <genexpr> at 0x119fbb5e8>,Liberal Times
《2012立委選戰最前線》民進黨小蝦米 力戰無盟大鯨魚（台中市第二選區）,https://news.ltn.com.tw/news/politics/paper/550753,"不但身兼大甲鎮瀾宮董事長，又是地方黑派要角，人脈雄厚，除了有鴻海總裁郭台銘相挺，還有國民黨馬英九及泛藍、地方派系輔選，加上知名度高的優勢，競選總部用餐時間經常齊聚數十桌，展現超高人氣。
但顏清標本身形...",<generator object <genexpr> at 0x119fbb660>,Liberal Times
中國的江丙坤,https://news.ltn.com.tw/news/opinion/paper/550752,"長；晚上跑中國，卻變成中國國民黨副主席。
早上在台灣，江丙坤大力宣揚中國國民黨總統候選人馬英九主張的「九二共識 」，並與高孔廉一起說三道四，批評民進黨總統候選人蔡英文提出的「台灣共識」。
晚上到了中...",<generator object <genexpr> at 0x119fbb6d8>,Liberal Times
跨年同歡 雙英熱場,https://news.ltn.com.tw/news/local/paper/550740,"與民眾同樂倒數跨年，另由文建會指導、明華園總編導的「藝術奧運．跨年晚會」，國民黨總統候選人馬英九也趕來，台南跨年活動在冷冬中多了「政治熱」！
「龍來台南」跨年晚會將於今晚七點盛大登場，南市首度移師高鐵...",<generator object <genexpr> at 0x11a088318>,Liberal Times
小型工程誰政績？ 藍搶功 綠消毒,https://news.ltn.com.tw/news/local/paper/550736,"甘示弱，發動黨籍市議員及里長挨家挨戶全面消毒，澄清小型工程都是市長陳菊核撥經費發包興建，與馬英九無關。
民進黨議員林芳如指出，小型工程是地方政府的權責，國民黨卻大言不慚欺騙選民，他自己還掏腰包租宣傳車...",<generator object <genexpr> at 0x11a088390>,Liberal Times
自主有力的台灣才能保障台商的權益,https://news.ltn.com.tw/news/opinion/paper/550718,馬英九總統連任選情果然「非常危急」，不但在中國催票的連勝文如此描述，拿公帑辦事的海基會董事長江丙坤也「早上在台北唱『九二共識』，晚上去上海喊馬凍蒜」，公然為馬英九助選。江丙坤角色嚴重錯亂，違反行...,<generator object <genexpr> at 0x11a088408>,Liberal Times
士林官邸正房二樓開放 收費惹爭議,https://news.ltn.com.tw/news/local/paper/550716,"頌德的東西，也要展覽戒、解嚴的文物史料，讓遊客了解台灣民主發展的意義。
林啟生表示，總統馬英九當初協調蔣家歸還正房，並未堅持把強人獨享的國家資產，一次到位還給全民，今年初應付式開放正房一樓與庭院，二樓...",<generator object <genexpr> at 0x11a088480>,Liberal Times
力挺廢核電 陳菊幫沈發惠站台,https://news.ltn.com.tw/news/local/paper/550704,昨天說，選總統就是一次對政府能源政策的公民投票，如果選民贊成現有核能發電能源政策，那要支持馬英九她沒意見；陳菊說，民進黨總統候選人蔡英文主張二○二五非核家園，她希望選民支持蔡英文，讓非核家園理想早日實現...,<generator object <genexpr> at 0x11a0884f8>,Liberal Times
宋籲顧腹肚︰不能為清廉 就不清泥,https://news.ltn.com.tw/news/focus/paper/550695,"〔記者曾鴻儒、施曉光／台北報導〕宋楚瑜昨日質疑馬英九「為了清廉，就不清泥」，強調他當選後將由中央統合解決主要河川淤積問題；他也提出農、漁業政見，並向選民「哭窮」，要大家上網看他的政見。
「顧腹肚，尚界...",<generator object <genexpr> at 0x11a088570>,Liberal Times
蔡打民生牌︰提供社宅 建長照體系,https://news.ltn.com.tw/news/focus/paper/550694,"以及建構長期照護體系等；如果政府沒有辦法做到，就是愧對年輕人，愧對下一代。
蔡英文並暗批馬英九說，「如果一個總統只會省錢，省自己的錢，卻不斷的花國家的錢」，這就是向下一代借錢，這樣的總統應讓他下台。...",<generator object <genexpr> at 0x11a0885e8>,Liberal Times
馬強調經濟︰把餅做大 才能顧弱勢,https://news.ltn.com.tw/news/focus/paper/550693,〔記者彭顯鈞／台北報導〕馬英九昨在第二場政見會提到擴大勞工紓困貸款、協助中小企業融資、節能家電補助等政策措施，強調堅持把經濟的餅做大，唯有繁榮的經濟，政府才能照顧中低收入戶、中小企業與中南部民眾，實現社...,<generator object <genexpr> at 0x11a088660>,Liberal Times
台灣共識vs.九二共識 雙英都要對方別害怕,https://news.ltn.com.tw/news/focus/paper/550692,曾鴻儒／台北報導〕兩岸議題再度成為昨晚總統大選電視政見會焦點，蔡英文的「台灣共識」繼續大戰馬英九的「九二共識」。蔡英文質疑，承認馬的「九二共識」，將會以「終極統一」為代價。馬英九反擊指這是惡意抹...,<generator object <genexpr> at 0x11a0886d8>,Liberal Times
蔡轟馬無能 斥國民黨負面選舉,https://news.ltn.com.tw/news/focus/paper/550691,〔記者蘇永耀／台北報導〕民進黨總統候選人蔡英文昨在電視政見發表會上，強力砲轟馬英九是「不適任、沒有擔當」的總統，她並質疑，國民黨只要選情告急，除負面選舉外，就會打安定牌，製造人民的不安和疑慮；國民黨不只...,<generator object <genexpr> at 0x11a088750>,Liberal Times
宋批藍打綠 籲選民讓他做做看,https://news.ltn.com.tw/news/focus/paper/550690,"〔記者施曉光／台北報導〕親民黨總統候選人宋楚瑜在昨晚第二場公辦政見發表會上，左批馬英九「無能」，右打蔡英文所屬的民進黨「貪腐」，強調自己既廉也能，向人民訴求跳脫藍、綠，讓他來做做看。
宋楚瑜昨天站在競...",<generator object <genexpr> at 0x11a0887c8>,Liberal Times
馬打清廉牌 批扁團隊又回來了,https://news.ltn.com.tw/news/focus/paper/550689,"〔記者彭顯鈞／台北報導〕國民黨總統候選人馬英九昨在第二場電視政見會大打「清廉牌」，痛批民進黨八年執政最貪腐，強調「陳水扁人馬都回來了，就圍繞在蔡主席身邊！」令人感到不安。
依抽籤順序首先發言的馬英...",<generator object <genexpr> at 0x11a088840>,Liberal Times
批情治監控 林瑞雄：馬令人厭惡,https://news.ltn.com.tw/news/focus/paper/550688,"民黨副總統候選人林瑞雄昨天下午在新北市受訪時，對蔡英文表示同情，並痛批監控蔡的行為太失格，馬英九及其幕僚利用國家機器對競選對手無所不用其極，令人深感厭惡、難堪又羞愧。
林瑞雄直言：「這還是小意思，還沒...",<generator object <genexpr> at 0x11a0888b8>,Liberal Times
行程起爭議 吳敦義：蔡栽贓抹黑,https://news.ltn.com.tw/news/focus/paper/550687,"助到富邦案，「她講的不是無中生有，就是栽贓抹黑」，不說明自己被質疑之處，卻以烏賊戰法噴墨給馬英九及他，欺騙社會、顛倒黑白。
吳敦義說，當天下午四點半他到場時，才有人告知蔡也要拜會賴。他當天沒打電話，反...",<generator object <genexpr> at 0x11a088930>,Liberal Times
如此濫權腐敗 勢必加速政黨輪替,https://news.ltn.com.tw/news/focus/paper/550685,任失敗之例，因此許多政治觀察者亟欲理解什麼是構成二○一二年三度政黨輪替的要件？正常情況下，馬英九沒有不連任的理由，但是現在的跡象卻顯示，馬英九嚮往的「開明專制」，已經把台灣推上了民主進程的一個瓶...,<generator object <genexpr> at 0x11a0889a8>,Liberal Times
馬稱沒下令 綠：關鍵在有無監控,https://news.ltn.com.tw/news/focus/paper/550684,、曾韋禎、彭顯鈞／台北報導〕民進黨總統候選人蔡英文指控遭情治監控案持續延燒，民進黨昨再質疑馬英九總統身為三軍統帥及國安會主席，不可能不知道有無監控；民進黨立委痛斥國安會越權指揮調查局，要求特偵組立即調查...,<generator object <genexpr> at 0x11a1572a0>,Liberal Times
情治監控？蔡籲查扣證據 馬嗆胡亂指控,https://news.ltn.com.tw/news/focus/paper/550683,"蔡促馬令調局 公布原始資料
〔記者羅添斌、彭顯鈞、蘇永耀、王寓中／台北報導〕蔡英文和馬英九昨天在公辦政見會上，就國安情治單位被控監控蔡英文一案有一番激辯。蔡當面質問，「馬總統你敢要求調查局將原始資料拿...",<generator object <genexpr> at 0x11a157318>,Liberal Times
〈冷眼冷語〉做莊出老千,https://news.ltn.com.tw/news/opinion/paper/550681,"馬英九在二○○八年總統選舉時承諾過不做政治監聽。馬英九從政以來更是一向標榜高道德標準。但是現在卻縱容手下監控蔡英文。
選舉就像打牌。公平的選舉就是打牌的各家不能出老千。在選舉中監控竊取競選對手...",<generator object <genexpr> at 0x11a157390>,Liberal Times
