titles,link,article,time,media
總統大選》批馬不在乎民怨　謝：讓驕傲公雞留歷史,https://news.ltn.com.tw/news/politics/breakingnews/592451,"黨總統候選人蔡英文的競選團隊總指揮謝長廷，在噗浪（plurk）po文批評，國民黨總統候選人馬英九說不在乎民怨，既然如此，選民就一起用選票把「驕傲的公雞留在歷史」。

　謝長廷在噗浪上表示，馬英九...",<generator object <genexpr> at 0x1191d9570>,Liberal Times
總統大選》企業紛表態　施明德：過度了,https://news.ltn.com.tw/news/politics/breakingnews/592440,時新聞／綜合報導〕台灣總統大選進入倒數期間，部分企業主表態挺「九二共識」與國民黨總統候選人馬英九。今（13）日前紅衫軍總指揮施明德接受媒體訪問時，指出這波企業界表態潮，已經「過度了」，會讓國人有中國以商...,<generator object <genexpr> at 0x1191d95e8>,Liberal Times
總統大選》日看大選　蔡英文、馬英九五五波,https://news.ltn.com.tw/news/politics/breakingnews/592439,"展開投票，與台灣關係相當密切的日本也關注這場選舉，日本媒體認為，這次選戰雖國民黨總統參選人馬英九有執政優勢，但是在野黨的民進黨總統候參人蔡英文卻急起直追，現在造成馬、蔡兩人的支持度是伯仲之間。

　...",<generator object <genexpr> at 0x1191d9660>,Liberal Times
總統大選》彭博社看大選　小豬威力力抗財團,https://news.ltn.com.tw/news/politics/breakingnews/592410,"有著反差的效果，小豬也吸引中下階層選民的支持。」

　針對國民黨的部分，彭博社認為，「馬英九主打與中國維持和平穩定，以確保台灣經濟穩定發展，無論是大財團或中小企業，都有可能被馬英九政策吸引，...",<generator object <genexpr> at 0x1191d96d8>,Liberal Times
總統大選》紐時關注台大選　「決定核能命運」,https://news.ltn.com.tw/news/politics/breakingnews/592376,"人的生活有相當緊迫的危機，蔡英文在台灣選舉中點出這個被許多人遺忘的議題，而國民黨總統候選人馬英九則在蔡英文之後，跟進加強馬政府核能政策的宣導。

　不過《紐約時報》評論指出，儘管馬英九在執政...",<generator object <genexpr> at 0x1191d9750>,Liberal Times
總統大選》網友再KUSO　候選人成電視劇主角,https://news.ltn.com.tw/news/politics/breakingnews/592332,"結，網友稱，「沒想到總統大選激發出人民的改圖能力。」

　雖許多人稱他們男帥女美，還說馬英九年輕時和王陽明長的很像，蔡英文也被與日本女星宮崎葵聯想在一塊，不過也有網友回應，「為什麼要破壞我美好的回憶...",<generator object <genexpr> at 0x1191d97c8>,Liberal Times
總統大選》周美青新營拜票　菜販生氣揮手,https://news.ltn.com.tw/news/politics/breakingnews/592249,馬友會動員支持者到場歡迎，場面熱烈，周美青一進入市場，也確實受到買菜的婆婆媽媽喜歡，高喊「馬英九當選」，熱情握手、擁抱和索取簽名。1小時5分後，周美青結束拜票時，剛好又遇上民進黨遊行車隊，擴聲器高喊請大...,<generator object <genexpr> at 0x1191d9840>,Liberal Times
總統大選》出示買票影帶　綠質疑買票放手一搏,https://news.ltn.com.tw/news/politics/breakingnews/592198,"，收錢的婦女比出2號手勢，民進黨指國民黨嘉義縣立委候選人翁重鈞已否認買票，國民黨總統候選人馬英九也是2號，那2號是誰？

民進黨發言人林俊憲質疑，國民黨說雲嘉南的選票開出來會讓大家跌破眼鏡，難道是靠...",<generator object <genexpr> at 0x1191d98b8>,Liberal Times
今日各報重點新聞一覽,https://news.ltn.com.tw/news/politics/breakingnews/592110,"北 宋固守台中
明天就是總統大選投票日，3組總統候選人今天卯足全力衝刺選票。國民黨候選人馬英九將搭乘總統專機，一晚連趕高雄、台中與台北三場造勢晚會，最後在凱道壓軸催票，要讓10萬人「馬英九凍蒜...",<generator object <genexpr> at 0x1191d9930>,Liberal Times
親中有回報,https://news.ltn.com.tw/news/opinion/paper/553977,"「九二共識概念股」，在多數股票疲弱之下，「九二共識概念股」一片紅通通的現象，令人側目。
馬英九執政三年半來向中國傾斜，雖然造成企業大量西進，台灣失業率居高不下，貧富差距加劇，但少數紅頂商人卻是既得利益...",<generator object <genexpr> at 0x1191d99a8>,Liberal Times
陪蘇俊賓拜票 周美青超人氣,https://news.ltn.com.tw/news/local/paper/553965,"抵達台南，陪同立委候選人蘇俊賓掃街站台，連「華語流行音樂教父」滾石唱片創辦人段鍾潭也現身為馬英九和蘇俊賓加油打氣。
周美青昨天下午抵達台南市松安里，拜訪里長黃高能、林杏枝夫婦，並參觀里長辦公室裡的老人...",<generator object <genexpr> at 0x1191d9a20>,Liberal Times
陳唐山掃街 賴清德相隨,https://news.ltn.com.tw/news/local/paper/553962,"
賴清德還公開反嗆藍營的李全教，文宣訴求自己爭取多少建設經費，「都是誇大之詞」，四年前為馬英九開的廢除國道新市、白河收費站政見支票，國民黨執政都無法兌現了，「他真的有能耐嗎？大家心知肚明」，鄉親千萬不...",<generator object <genexpr> at 0x1191d9a98>,Liberal Times
高市綠營目標 小英96萬票起跳,https://news.ltn.com.tw/news/local/paper/553961,"〔記者侯承旭、蔡清華／高雄報導〕民進黨設定蔡英文在高雄市要贏馬英九二十二萬票，若以選舉人數與投票率換算，英嘉配得票數必須從九十六萬票起跳，藍營則希望將藍綠得票差距，壓在十萬票以內。
國民黨盼差距壓在1...",<generator object <genexpr> at 0x1191d9b10>,Liberal Times
藍議員挺綠 李鴻鈞替邱議瑩拉票,https://news.ltn.com.tw/news/local/paper/553960,"卻讓他立場更堅定。
李鴻鈞指出，上一屆立委選戰中，他爭取國民黨提名受阻，主要因素就是總統馬英九「屈服」於親民黨，提名吃親民黨奶水長大的鍾紹和代表泛藍競逐，讓在地方服務超過十五年的他相當不服氣，加上看不...",<generator object <genexpr> at 0x1191d9b88>,Liberal Times
今天，想一想,https://news.ltn.com.tw/news/opinion/paper/553926,"旦台灣淪為中國的一部分，軍公教的薪資、退休待遇會不會向中國的低水準看齊？
今天，想一想，馬英九稱所謂的「九二共識」締造台海和平，為什麼中國瞄準台灣的飛彈卻增加了？馬英九說「外交休兵」沒有製造麻...",<generator object <genexpr> at 0x1191d9c00>,Liberal Times
街頭巷戰 選將猛拜票狂掃街,https://news.ltn.com.tw/news/local/paper/553917,〔記者邱紹雯／台北報導〕選戰倒數時刻，台北市第五選區國民黨立委候選人林郁方請來總統馬英九、國民黨榮譽主席吳伯雄、台北市長郝龍斌及國民黨中常委連勝文等人輪番造勢，展現高人氣及政壇好人緣；民進黨立委候選人顏...,<generator object <genexpr> at 0x1192a0660>,Liberal Times
選情緊繃 簡余晏、羅淑蕾告急 感性催票,https://news.ltn.com.tw/news/local/paper/553916,"粉底白字「為權益，總動員」、「感謝相挺，簡余晏鞠躬」旗幟；羅淑蕾則在路邊懸掛紅底白字「支持馬英九，力挺羅淑蕾」布條。
羅淑蕾表示，在北松山眷村贏很大，中山區也領先對手，總統馬英九、立委蔣孝嚴及...",<generator object <genexpr> at 0x1192a06d8>,Liberal Times
馬輔選李慶華 羅福助支持者包圍,https://news.ltn.com.tw/news/local/paper/553913,"止區重演？
無黨籍立委候選人羅福助昨天發動大批支持者到汐止忠順廟「歡迎」國民黨總統候選人馬英九，穿著羅福助總部紅背心的支持者站滿大同路兩側；「羅福助凍蒜！」「馬英九凍蒜！」震天價響，馬英九...",<generator object <genexpr> at 0x1192a0750>,Liberal Times
南方朔疾呼︰台灣必須改變,https://news.ltn.com.tw/news/focus/paper/553904,"好談你的願景、談如何落實，這些大方向的，可是這些幾乎沒有，所以我就非常失望，不以為然。
馬英九在第一任贏這麼多，國會又有四分之三，可以做很多很多事情，而且阻力會是最小的，結果四年都沒有做出什麼事情出來...",<generator object <genexpr> at 0x1192a07c8>,Liberal Times
蔡︰馬沒政績 只會販賣恐懼,https://news.ltn.com.tw/news/focus/paper/553900,強調，台灣需要有打開胸襟、廣納人才、與人民對話的領導人，選蔡英文，就是選社會團結、和諧，選馬英九，就是繼續對抗分裂；選蔡英文就是政黨合作，選馬英九就是繼續一黨獨大、黨國不分；選蔡英文就是選清廉、...,<generator object <genexpr> at 0x1192a0840>,Liberal Times
軍公教子女要惜福,https://news.ltn.com.tw/news/opinion/paper/553893,"◎ 張尚義
這幾天，有幾位軍公教出來提醒，馬英九的終極統一，最後會讓軍公教的優渥待遇「歸零」，甚而「統一」之後遭到中國共產黨的政治清算。
或許，不少軍公教會認為，別擔心。是嗎？一九四九年之後，「投共...",<generator object <genexpr> at 0x1192a08b8>,Liberal Times
我還想養老 我不笨,https://news.ltn.com.tw/news/opinion/paper/553892,藍要好同仁辦理退休時，知道我是辦理月退，有天跑到我辦公室來對我說，你怎麼這麼傻、真沒眼光，馬英九當選總統了，阿扁總統把股票盪到九三○○點，馬英九執政了、股票他掛保證沒有兩萬點也保證有一萬五千點；...,<generator object <genexpr> at 0x1192a0930>,Liberal Times
不要換第一夫人 乾脆女人當總統,https://news.ltn.com.tw/news/opinion/paper/553888,"置空下來，表達對周美青的敬意。
第二，如果真正心疼周美青的辛勞，那更應該投給蔡英文，因為馬英九選輸後，周美青就可以好好的休息，不需要再東奔西跑的當她老公的救火隊。
第三，如果你覺得周美青是熱心公益的...",<generator object <genexpr> at 0x1192a09a8>,Liberal Times
台灣未來 不能賣 蔡籲選民 不要投買票的政黨、候選人,https://news.ltn.com.tw/news/focus/paper/553887,"中台灣是決戰點，也是買票最嚴重的地區，依照過去的紀錄，國民黨不只會買票，還曾經在花蓮作票，馬英九說要清廉政治，買票算乾淨嗎？
民進黨：中彰投以南賄選嚴重
民進黨發言人陳其邁說，中彰投、雲嘉南與高屏等...",<generator object <genexpr> at 0x1192a0a20>,Liberal Times
補助分藍綠 農委會被控變相賄選,https://news.ltn.com.tw/news/politics/paper/553881,"近核發合作農場、果菜生產合作社等二十萬到五十萬元的小型補助款，同時要求票投國民黨總統候選人馬英九，光雲林縣就撒下千萬元。
雲林縣副縣長施克和說，最近接到農民反映，農糧署像「人二系統」，自動將農場、合作...",<generator object <genexpr> at 0x1192a0a98>,Liberal Times
馬陷苦戰 美媒：貧富差距擴大,https://news.ltn.com.tw/news/politics/paper/553880,〔編譯陳成良／綜合報導〕台灣明天舉行總統大選，全球矚目，國際主要媒體普遍認為，尋求連任的馬英九與民進黨候選人蔡英文勢均力敵，甚至陷入苦戰，而經濟是這次大選的核心焦點。美國「基督教科學箴言報」甚至提到，由...,<generator object <genexpr> at 0x1192a0b10>,Liberal Times
周美青拜票 攤商嗆,https://news.ltn.com.tw/news/politics/paper/553877,姨新年快樂」！讓面帶倦容的酷酷嫂笑開懷。不過，她晚間到台南花園夜市時，一名男子在遠處高舉「馬英九昏庸無能下台」牌子，並高喊要馬下台，之後在友人勸說下離開；還有一位民眾在遠處以大聲公喊「蔡英文加油、凍蒜」...,<generator object <genexpr> at 0x1192a0b88>,Liberal Times
林瑞雄︰ 14日開票將翻盤,https://news.ltn.com.tw/news/politics/paper/553876,"講明白」。
林瑞雄表示，十四日開票結果將「翻盤」，他和宋楚瑜是唯一獲過半數選票的候選人，馬英九總統做得那麼差，應該拿不到三百萬票。
林瑞雄昨由親民黨籍高市議員吳益政陪同，參訪橋仔頭糖廠白屋文創園區，...",<generator object <genexpr> at 0x1192a0c00>,Liberal Times
吳敦義 暗諷李遠哲,https://news.ltn.com.tw/news/politics/paper/553875,前，一位去年獲諾貝爾獎的美國經濟學家來看他，第一句話就跟他說，「我們歐巴馬那匹馬如果像你們馬英九這匹馬這樣：經濟成長率這麼高，物價成長率那麼低，失業率降到四．二八，那躺著選也可當選」。...,<generator object <genexpr> at 0x1192a0c78>,Liberal Times
「最後關頭，還需大老來保你」 宋問馬︰怎不慚愧,https://news.ltn.com.tw/news/politics/paper/553872,人宋楚瑜昨深入藍營大票倉新北市中永和、新店傳統市場拜票，對國民黨榮譽主席連戰喊出集中選票投馬英九，宋楚瑜回應說，「馬總統，你不能讓大老安心，也不能讓台灣老百姓安心，到了選舉最後關頭，需要別人來保你，不覺...,<generator object <genexpr> at 0x1192a0cf0>,Liberal Times
台聯面臨最後一戰 懇請一戶一票搶救,https://news.ltn.com.tw/news/politics/paper/553871,車板、弱勢的代言人、民進黨的防腐劑。馬總統以假的九二共識和中國聯手打壓台灣，台聯站出來戳破馬英九的謊言，去法院控告馬英九叛國；過去幾年台聯幫助受到中國廉價品打擊的台灣傳統產業，也是聲援受害台商最...,<generator object <genexpr> at 0x11936e840>,Liberal Times
蔡︰勝選後主持國際記者會,https://news.ltn.com.tw/news/politics/paper/553869,"可能讓台灣面臨許多經濟、軍事和政治上的不確定性，這是台灣有風險的地方，必須非常注意。
對馬英九說多次邀請蔡英文都被拒絕，蔡英文說，一個總統如果要邀請在野黨主席對談，應主題明確，並經過幕僚作業，但馬總統...",<generator object <genexpr> at 0x11936e8b8>,Liberal Times
國際記者會 馬︰如果連任總統 訪中機會小,https://news.ltn.com.tw/news/politics/paper/553868,〔記者王寓中／台北報導〕國民黨總統候選人馬英九昨召開國際記者會，被問到若連任有無計畫訪問中國，馬表示，現在完全沒有訪問中國的計畫，目前看來機會也非常小，因為不論到哪裡，他都是中華民國總統，這個身分不能改...,<generator object <genexpr> at 0x11936e930>,Liberal Times
樂觀選情／馬︰我有信心 大家拭目以待,https://news.ltn.com.tw/news/politics/paper/553866,"氣氛也逐漸蔓延，尤其北市大遊行的成功，藍營內部不少人還樂觀預估，勝選票數「還要上修」！
馬英九昨天在國際記者會上信心滿滿表示，現在已經有很多的民眾了解，國家需要有處理經濟危機經驗、清廉正派、關懷弱勢、...",<generator object <genexpr> at 0x11936e9a8>,Liberal Times
馬回防雙北 進眷村感受溫暖,https://news.ltn.com.tw/news/politics/paper/553865,瑾、郭顏慧、潘杏惠／綜合報導〕選戰倒數計時，為鞏固基本盤，衝高北部投票率，國民黨總統候選人馬英九昨橫掃雙北眷村、國宅鐵票區；出席科技產業後援會時，馬推銷九二共識，強調兩岸開放「讓大家做生意做得很爽」，這...,<generator object <genexpr> at 0x11936ea20>,Liberal Times
收固樁費 三重11鄰長認罪,https://news.ltn.com.tw/news/politics/paper/553861,選總部發簡訊通知媒體，指「三重區光華里里長及數十位鄰長涉嫌買票，檢察官於新北調查處偵辦中，馬英九、李乾龍競選總部主委陳幸進現至新北市調查處施壓，高志鵬由議員陪同現至現場召開記者會」，隨後再發簡訊通知選民...,<generator object <genexpr> at 0x11936ea98>,Liberal Times
這一票，投給公平正義！,https://news.ltn.com.tw/news/opinion/paper/553841,"
不少政治觀察家認為，這是台灣一九九六年首度總統民選以來，朝野競爭最不公平的一次，國民黨馬英九陣營為保馬連任，不擇手段到了粗魯殘忍（宋楚瑜悲憤語）地步。
選戰最後，回首選戰，國民黨馬陣營是怎麼「對付...",<generator object <genexpr> at 0x11936eb10>,Liberal Times
藍估大選 馬吳可贏20萬票,https://news.ltn.com.tw/news/local/paper/553829,"和姑姑、姑丈們組成「娘家助選團」，為陳學聖拉票。
晚上，副總統蕭萬長也到桃園縣拜票，推崇馬英九總統清廉，也到平鎮市為呂玉玲站台，再趕到中壢市陳學聖總部助陣，希望都能高票當選。
宋楚瑜陪劉文雄拜票
...",<generator object <genexpr> at 0x11936eb88>,Liberal Times
綠拚勝選 期落後10萬票內,https://news.ltn.com.tw/news/local/paper/553828,"有違行政中立原則才會派人拆除。
清潔隊打開倉庫供檢視，裡頭堆放有彭添富、呂玉玲、蔡英文、馬英九等人的旗幟。...",<generator object <genexpr> at 0x11936ec00>,Liberal Times
台中造勢場超人氣 8選將同台喊8仙過海,https://news.ltn.com.tw/news/local/paper/553812,民黨一黨獨大，才無法發揮監督效能，要發揮國會效能，一月十四日就要讓民進黨提名的立委過半。而馬英九只會用九二共識恐嚇人民，用台獨恐嚇北京，總統大選，一定要換掉無能的總統，讓蔡英文當選。...,<generator object <genexpr> at 0x11936ec78>,Liberal Times
彰化拚綠地 小英催票 拉攏傳統產業,https://news.ltn.com.tw/news/local/paper/553810,"
蔡英文感冒沙啞的聲音也引起很多支持者不捨，有人說，至少要再拉五票；也有人說，總統若還是馬英九，移民算了，避免有一天變成中國殖民地；溪州鄉長黃盛祿說，蔡英文若落選，以後他會慢慢淡出政治，沒什麼意義了。...",<generator object <genexpr> at 0x11936ecf0>,Liberal Times
固票 吳敦義拉抬黨籍選將,https://news.ltn.com.tw/news/local/paper/553807,"嘉義縣競選總部主委黃文章等人站台，現場湧入十八鄉鎮市數千位支持者搖旗吶喊。 
黃文章稱許馬英九開放兩岸直航，方便台商返鄉；陸客來台，讓阿里山攤商以及遊覽車業者賺到錢；中國領導人胡錦濤宣稱沒有九二共識，...",<generator object <genexpr> at 0x11936ed68>,Liberal Times
中彰環團要求撤銷2火力電廠開發案,https://news.ltn.com.tw/news/life/paper/553754,"準，比六輕的污染還嚴重。
綠黨批政府玩兩面手法
綠黨西屯、南屯區立委候選人蔡智豪也說，馬英九總統去年四月承諾進行細懸浮微粒總量管制，據學者研究，台灣若要達到ＷＨＯ的標準，污染源必須減少七十％，相當於...",<generator object <genexpr> at 0x11936ede0>,Liberal Times
總統大選》宋闖藍營票倉　批藍「近親繁殖」,https://news.ltn.com.tw/news/politics/breakingnews/592022,候選人林瑞雄今天在高雄市橋頭糖廠拜票時，除了信心滿滿的認為宋林2人一定會當選，也大膽預估，馬英九的無能執政，將使得票率不超過3百萬票，進而敗選。...,<generator object <genexpr> at 0x11936ee58>,Liberal Times
網友KUSO　馬蔡宋變「送酒菜樂團」,https://news.ltn.com.tw/news/politics/breakingnews/591998,"合成照中，3人被套進台灣知名的飛兒樂團專輯封面，宋楚瑜是吉他手阿沁，蔡英文則是女主唱飛兒，馬英九被合成建寧老師，此圖一出，在網路上被瘋狂轉載，許多網友大呼，「農曆過年就是要聽送酒菜樂團。」

　事實...",<generator object <genexpr> at 0x11936eed0>,Liberal Times
總統大選》批馬政績差　宋楚瑜籲換人做,https://news.ltn.com.tw/news/politics/breakingnews/591899,，30多年前，經國先生在桃園做了中正機場，當時是全亞洲最漂亮的機場，但是，愛台十二項建設，馬英九總統花了4兆，看看現在南崁交流道每天大塞車，桃園機場屋頂漏水，跑道還有洞，運行李的車還把飛機撞了個洞，這是...,<generator object <genexpr> at 0x11943ced0>,Liberal Times
總統大選》大批羅福助支持者　包圍馬英九車隊,https://news.ltn.com.tw/news/politics/breakingnews/591898,〔記者俞肇福、楊培華／新北報導〕國民黨總統候選人馬英九今天下午要到新北市汐止區忠順廟幫黨籍立委候選人李慶華站台助講；車隊在大同路二段遭到無黨籍候選人羅福助動員而來的支持者團團包圍，大同路兩旁站滿羅福助支...,<generator object <genexpr> at 0x11943cf48>,Liberal Times
總統大選》周美青基隆掃街　攤商怨無法做生意,https://news.ltn.com.tw/news/politics/breakingnews/591815,"都不用做生意了。

　由於七堵選出的國民黨籍市議員張耿輝這次脫黨參選立委，國民黨繼昨天馬英九、吳敦義先後掃街拜票外，今天一早被視為吸票機的「酷酷嫂」周美青到七堵陪同謝國樑向商家、民眾握手請託。
...",<generator object <genexpr> at 0x11943f048>,Liberal Times
總統大選》老百姓挺小英布條　獲熱烈迴響,https://news.ltn.com.tw/news/politics/breakingnews/591748,"紛紛表達意見，還有人說這是「一針見血。」

　日前財團大老闆一個個跳出來，表態力挺總統馬英九，許多網友認為，這是因為大老闆利益與馬政府一致，但小老百姓薪水不升反降，物價卻步步高升，而馬英九上...",<generator object <genexpr> at 0x11943f0c0>,Liberal Times
總統大選》竹縣拜票　蘇嘉全預期客家票大幅成長,https://news.ltn.com.tw/news/politics/breakingnews/591735,"全說，他充分感受到客家鄉親的熱情，也預期這次民進黨的客家票會大幅成長。

　蘇嘉全說，馬英九政府在許多客家方面的政見和應該做給客家庄的建設都跳票，例如客家廣播電台和客家預算成長都沒做到，這讓客家鄉親...",<generator object <genexpr> at 0x11943f138>,Liberal Times
總統大選》4年做不好　宋批馬不覺慚愧嗎？,https://news.ltn.com.tw/news/politics/breakingnews/591733,〔即時新聞／綜合報導〕選戰倒數關鍵時刻，國民黨榮譽主席連戰昨天公開表態支持總統馬英九外，也向昔日戰友、親民黨總統候選人宋楚瑜溫情喊話。對此，宋楚瑜今天批評，馬英九做了4年總統卻做不好，「還要大老...,<generator object <genexpr> at 0x11943f1b0>,Liberal Times
總統大選》網友KUSO改圖　蔡英文超萌,https://news.ltn.com.tw/news/politics/breakingnews/591654,"就是團體，不是敵人了。」

　網友認為，改變造型的3人可以組成樂團，由蔡英文擔任主唱，馬英九為吉他手，宋楚瑜則為貝斯手，而這個新團體將在1月14日發表，網友表示，這一團男帥女美，簡直是夢幻偶像團體，...",<generator object <genexpr> at 0x11943f228>,Liberal Times
今日各報重點新聞一覽,https://news.ltn.com.tw/news/politics/breakingnews/591648,"進行全台瘋狂掃街拜票。

選情拉鋸 馬蔡決勝中台灣
總統大選選情白熱化，國民黨候選人馬英九昨「馬不停蹄」，1天27個行程跑遍東北角；民進黨候選人蔡英文昨到苗栗、新竹地毯式車隊掃街，晚上出席選前高雄...",<generator object <genexpr> at 0x11943f2a0>,Liberal Times
大聯合政府讚,https://news.ltn.com.tw/news/opinion/paper/553742,"蔡英文拋出大聯合政府主張，顯然讓馬英九感到驚訝莫名，氣急敗壞，因此全黨上下對這個選舉以來最有牛肉的政見，展開情緒性的攻擊，可見此舉已經打中馬陣營的要害。
前副總統連戰甚至跳出來當急先鋒，批判此舉違憲，...",<generator object <genexpr> at 0x11943f318>,Liberal Times
3總統選將「個性劍獅」小英築夢實事求是,https://news.ltn.com.tw/news/local/paper/553738,"目的是，對應農曆生日的「劍獅守護神」。昨日業者公開這項規劃近一年的商品，並挑出包括蔡英文、馬英九、宋楚瑜三位總統候選人的對應劍獅、分析每個人的個性。
馬保守秘密 宋沈默銳利
其中一號蔡英文，依個性分...",<generator object <genexpr> at 0x11943f390>,Liberal Times
《緊咬媽祖園區》楊曜批縣長浪費公帑,https://news.ltn.com.tw/news/local/paper/553732,"。
至於王乾發請假輔選期間，借用縣府會議室，邀集縣府各科處人員，公開要脅公務人員支持總統馬英九與無黨籍立委候選人林炳坤，簡余晏痛批國民黨運用行政資源、動員國營單位參加造勢晚會、還公然要脅公務人員投票意...",<generator object <genexpr> at 0x11943f408>,Liberal Times
催票總動員 綠議員促力保5席全上,https://news.ltn.com.tw/news/local/paper/553729,"及台北—花蓮八班次，都偏藍營票倉，他籲請台鐵應給學生返鄉投票優惠。
李文正與陳進益表示，馬英九「執政無能、投共萬能」，台灣經濟下滑，民眾手中的一票，同時影響子孫未來和台灣前途。
台鐵︰選舉加班車 運...",<generator object <genexpr> at 0x11943f480>,Liberal Times
