titles,link,article,time,media
攤開國民黨政府的經濟成績單,https://news.ltn.com.tw/news/opinion/paper/544546,"◎ 黃子維
檢驗馬英九於總統辯論會時提出的一堆數字，首先，攤開經濟成績單，馬政府執政至今的平均經濟成長率只有三．二四％，遠低於民進黨八年的四．四％。台灣與韓國的人均ＧＤＰ差距，也從二○○八年的一七五四...",<generator object <genexpr> at 0x11cc60138>,Liberal Times
九把刀被中國山寨 馬英九ECFA破功,https://news.ltn.com.tw/news/opinion/paper/544545,"◎ 沈政男
馬英九在總統大選電視辯論上說，「簽ＥＣＦＡ後，兩岸智慧財產權保護協議也有簽，台灣電影能到大陸去放映，不會受到山寨版侵犯。」言猶在耳，就傳出台灣當紅電影《那些年我們一起追的女孩》，正準備明年...",<generator object <genexpr> at 0x11cc601b0>,Liberal Times
曾代言ECFA支持馬政策／織襪業者轉挺小英,https://news.ltn.com.tw/news/focus/paper/544539,取支持，獲得重大進展。除拜訪國民黨籍田中鎮長鄭俊雄，引起拔樁聯想，更受注目的是，曾出面力挺馬英九總統ＥＣＦＡ政策的台灣區織襪公會理事長魏平祺，昨率多位織襪業負責人力挺小英，送上小豬撲滿，並以「三隻小豬勝...,<generator object <genexpr> at 0x11cc60228>,Liberal Times
水利會「黑道放生」條款 藍急喊卡,https://news.ltn.com.tw/news/politics/paper/544534,"此案通過修法觀感不佳，國民黨中央急踩煞車，昨晚由文傳會主委莊伯仲發出新聞稿強調，國民黨主席馬英九對此相當不滿，並已即刻指示國民黨立法院黨團，不得通過此一修正草案。
據現行農田水利會組織通則第卅七條規定...",<generator object <genexpr> at 0x11cc602a0>,Liberal Times
白賊與烏賊都是賊,https://news.ltn.com.tw/news/opinion/paper/544505,"導選民。他們一發現錯誤，也立即說明「甜柿」照片是誤用。
但不關心農民生計、只知政治鬥爭的馬英九，不知查明事實，檢討政策，反以總統之尊打烏賊戰，痛罵在野黨以模糊焦點；國防部下令阿兵哥把「胃」捐給馬英...",<generator object <genexpr> at 0x11cc60318>,Liberal Times
藍綠造勢 幸福小豬PK水果平安福,https://news.ltn.com.tw/news/local/paper/544460,長廷表示，四年前流行「馬」，今年流行「豬」，代表風水輪流轉，養小豬就是要對抗國民黨的特權；馬英九四年前提出「六三三」及陸客來台一天一萬人、股市上萬點等政見全部跳票，總統府不是訓練所、研究所，做不到就下台...,<generator object <genexpr> at 0x11cc60390>,Liberal Times
《拜票走透透》白天到夜晚 英嘉不停蹄,https://news.ltn.com.tw/news/local/paper/544457,午至晚間，全力在彰化縣各地造勢，他先後拜訪身兼國民黨鎮田中鎮黨部主委的田中鎮長鄭俊雄，及與馬英九合拍「ECFA」的台灣區織襪公會理事長魏平祺，再到溪湖鎮和二林鎮參加兩場小英之友會，晚間她更與副手蘇嘉全到...,<generator object <genexpr> at 0x11cc60408>,Liberal Times
行政不中立？　吳清基喊冤,https://news.ltn.com.tw/news/politics/breakingnews/576220,〔即時新聞／綜合報導〕針對民進黨抨擊教育部長吳清基在餐會替總統馬英九、行政院長吳敦義輔選，根本是「行政不中立」一事，吳清基昨日晚間澄清，絕無違反行政中立，他今(5)日再度出面澄清，他說，馬英九和...,<generator object <genexpr> at 0x11cc60480>,Liberal Times
總統大選》脫衣廣告諷馬　綠批馬只挺財團,https://news.ltn.com.tw/news/politics/breakingnews/576179,"視廣告，主打貧富差距議題。民進黨發言人陳其邁表示，馬政府執政3年多，貧富差距急速拉大，顯然馬英九在這個問題上，交出一張不及格的成績單。

　蔡辦今天推出第4支電視廣告，被命名為「貧富差距篇」，一開始...",<generator object <genexpr> at 0x11cd27f48>,Liberal Times
總統大選》雙英PK　決戰中南部,https://news.ltn.com.tw/news/politics/breakingnews/576167,統參選人蔡英文明(6)日展開「台17線──媽祖文化行腳」造勢行程，目標鎖定中南部縣市；總統馬英九則將於12月11日「前進夜市」，到台南永康夜市發放印有政績的面紙盒。另外，「酷酷嫂」周美青也於今(5)日到...,<generator object <genexpr> at 0x11cd2b048>,Liberal Times
廣告出現馬照片　台鹽挨批不中立,https://news.ltn.com.tw/news/politics/breakingnews/576166,"潔用品、飲用水以及保健食品，不過，民進黨立委黃偉哲指出，最近台鹽的新廣告中，卻頻頻出現總統馬英九的照片，再加上台鹽董座洪璽曜是國民黨不分區立委郭素春的丈夫，黃偉哲不禁質疑，台鹽根本在替國民黨打廣告。
...",<generator object <genexpr> at 0x11cd2b0c0>,Liberal Times
統計共44件賄選　綠疑馬上任後國民黨更賄選,https://news.ltn.com.tw/news/politics/breakingnews/575963,〔記者李欣芳／台北報導〕總統馬英九上週六在總統大選辯論時指他改變了國民黨，民進黨上午拿出統計資料，不僅嘲諷馬英九讓國民黨更「賄」選，計有44位國民黨的立委、議員、鄉鎮市長候選人因賄選或貪污案被判...,<generator object <genexpr> at 0x11cd2b138>,Liberal Times
今日各報重點新聞一覽,https://news.ltn.com.tw/news/politics/breakingnews/575897,"。

中國時報
宋熄火 藍怕怕 綠怪怪
宋楚瑜首場總統電視辯論表現，未如預期出現對馬英九總統展開凌厲攻勢，引發各界揣測不斷，藍綠橘三陣營也各有解讀。藍營「正面看待」宋的轉變，但內部也有人憂心，「...",<generator object <genexpr> at 0x11cd2b1b0>,Liberal Times
對阿扁黑影揮拳,https://news.ltn.com.tw/news/opinion/paper/544402,"馬英九的作風，是否如其所宣傳的，是一個「一路走來、始終如一」的人，固然外界頗多質疑，但是在「批扁」這方面，沒有人會懷疑。
馬英九與陳水扁是政治對手，但從另一角度看，阿扁其實是他的貴人與提款機，...",<generator object <genexpr> at 0x11cd2b228>,Liberal Times
陳致中成立總部 郭玟成籲勿分裂,https://news.ltn.com.tw/news/local/paper/544384,"議員資格也被取消，參選立委是為了爭取台灣人的尊嚴和勝利。支持者嘶吼要把陳致中送進立法院，給馬英九總統顏色瞧瞧。
不過，同選區的民進黨提名立委候選人郭玟成稍早則在一場問政說明會表示，「為阿扁討公道不是靠...",<generator object <genexpr> at 0x11cd2b2a0>,Liberal Times
治國不是逞口舌之快 而是要高瞻遠矚,https://news.ltn.com.tw/news/opinion/paper/544320,第一輪總統大選辯論會結束，三位候選人馬英九、蔡英文、宋楚瑜的表現如何？各方評價不一，各有所好，難有定論，這是必然的現象。然而，檢視候選人辯論會的表現，重點顯然不在辯論技巧的優劣，治國並非演講比賽，歷史已...,<generator object <genexpr> at 0x11cd2b318>,Liberal Times
力挺顏聖冠 蘇貞昌站台,https://news.ltn.com.tw/news/local/paper/544319,"一任都做不好，連任沒有競選壓力，結果是一個月出國不見人影、北北基聯測搞得亂七八糟」，暗指讓馬英九繼續連任，也只是「越做越差」。
蘇貞昌說，選好的立法委員有兩個原則，分別為「顧台灣、為基層」，也力挺連任...",<generator object <genexpr> at 0x11cd2b390>,Liberal Times
站台「消毒」 羅淑蕾造勢 馬駁藍皮橘骨,https://news.ltn.com.tw/news/local/paper/544317,"）選區立委候選人羅淑蕾，昨天成立全國會計師界、松山軍榮眷力挺「馬吳配」與她的後援總會，總統馬英九等人站台時，不約而同地消毒泛藍支持者對她「橘骨藍皮」的疑慮，彌合她與副主席、立委蔣孝嚴的初選傷痕。
羅淑...",<generator object <genexpr> at 0x11cd2b408>,Liberal Times
羅致政護台晚會 蘇貞昌相挺,https://news.ltn.com.tw/news/local/paper/544316,不出來投票，別人就替你做選擇。他比喻「選總統就像叫計程車」，四年前大家以為找到個好司機（指馬英九），長得帥又自誇路很熟，結果四處亂逛，撞電線桿還掉落水溝，現在好不容易到站，還說要人家繼續搭他的車，遇到這...,<generator object <genexpr> at 0x11cd2b480>,Liberal Times
藍造勢太吵？ 鬧鐘從天而降,https://news.ltn.com.tw/news/focus/paper/544306,"，同時也將鬧鐘側蓋上採得的三分之一指紋送刑事局比對，但初步無結果。
昨天上午九時廿五分，馬英九抵達後一切正常，未再掉落什麼異物。警方表示，鬧鐘墜地處距舞台約百餘公尺，鑑識人員察看時，鬧鐘還在運轉，沒有...",<generator object <genexpr> at 0x11cd2b4f8>,Liberal Times
馬提醫療產業化 醫改團體有疑慮,https://news.ltn.com.tw/news/focus/paper/544305,〔記者王昶閔、賴筱桐／綜合報導〕國民黨總統候選人馬英九昨出席醫事團體挺馬造勢大會時，重申政府推動國際醫療與醫療產業化的決心，但國內三大醫改團體擔心，政府一心推動國際醫療，雖有利於醫院經營者與財團，卻恐將...,<generator object <genexpr> at 0x11cd2b570>,Liberal Times
宋質問馬 為什麼離人民那麼遠？,https://news.ltn.com.tw/news/focus/paper/544304,，二○○○年人民痛恨黑金，給扁執政機會，卻見到民進黨與一家人的貪腐；二○○八年讓馬當選，盼馬英九勵精圖治，卻是「美麗的數字，鄉親感受得到嗎？分享到社會好的結果嗎？」實情是財團與政黨壟斷所有資源，卻沒有為...,<generator object <genexpr> at 0x11cd2b5e8>,Liberal Times
小英：馬只會罵人、背數字,https://news.ltn.com.tw/news/focus/paper/544303,〔記者李容萍、張菁雅、佟振國／綜合報導〕總統選戰白熱化，馬英九總統抨擊民進黨的砲火也日趨猛烈，民進黨總統候選人蔡英文昨天反擊說，馬總統老是拿很多數字來說政績多好，但民眾都聽不懂，也感受不到，而且馬越來越...,<generator object <genexpr> at 0x11cd2b660>,Liberal Times
綠整軍出擊 週六凱道小豬大集結,https://news.ltn.com.tw/news/focus/paper/544302,"參與。
馬營應戰 當天在北市密集造勢
國民黨馬吳陣營為因應綠營在凱道大造勢，總統候選人馬英九當天將在台北市密集參加後援會成立造勢活動，「雙英對決」屆時仍將成為媒體焦點。
針對日前發生的柿價風波，蔡...",<generator object <genexpr> at 0x11cdfb0c0>,Liberal Times
蘇37年婚慶日 北桃中彰繞圈輔選,https://news.ltn.com.tw/news/focus/paper/544301,"場子助選，他笑問觀眾「我有夠拚沒？」贏得熱烈掌聲。
呂：藍若續執政 台灣穩破產
 針對馬英九總統在前天電視辯論會強烈質疑民進黨，蘇貞昌與呂秀蓮、謝長廷等綠營天王昨天也都重砲反擊馬英九。
 ...",<generator object <genexpr> at 0x11cdfb138>,Liberal Times
還要靠扁 有志氣一點吧！,https://news.ltn.com.tw/news/focus/paper/544299,"記者鄒景雯／特稿
總統大選第一場辯論會結束，馬英九昨日轉到競選場上繼續「辯論」，延續性的主題是什麼？陳水扁與扁團隊。這真是一個不知長進、從小被寵壞的獨子！四年前，靠著陳水扁當選，居然以為四年間政績乏善...",<generator object <genexpr> at 0x11cdfb1b0>,Liberal Times
蔡營反擊：讓馬留在2008,https://news.ltn.com.tw/news/focus/paper/544298,〔記者李欣芳、吳為恭／綜合報導〕馬英九總統昨再批評民進黨總統候選人蔡英文的競選團隊有很多前總統陳水扁的愛將，社會觀感不佳，蔡英文競選辦公室昨反擊說，馬總統既然對阿扁念茲在茲，就讓馬停留在過去；民進黨也砲...,<generator object <genexpr> at 0x11cdfb228>,Liberal Times
馬再轟蔡：愛用扁愛將,https://news.ltn.com.tw/news/focus/paper/544297,〔記者翁聿煌、潘杏惠、陳璟民、黃忠榮／綜合報導〕國民黨總統候選人馬英九昨天在大台北地區為國民黨立委候選人站台時，延續三日總統候選人辯論會砲火，批評民進黨的不分區立委名單中許多是陳水扁愛將，社會觀感不佳，...,<generator object <genexpr> at 0x11cdfb2a0>,Liberal Times
給慈濟人的一封信,https://news.ltn.com.tw/news/opinion/paper/544293,"◎ 洪福基
中國國民黨黨章明白宣示要與中國統一，而且台灣總統馬英九先生已經放出要和中國簽和平協議的訊息，從圖博歷史的教訓可知，一旦簽了和平協議，台灣可能就會被中共統治。
中共最怕有組織的人民團體，因...",<generator object <genexpr> at 0x11cdfb318>,Liberal Times
以國小算術戳破馬英九的牛皮,https://news.ltn.com.tw/news/opinion/paper/544289,1.0160+1.0323+1.0488=3.0971，還大於3.0915；換句話說，縱使馬英九自稱二○一○年的經濟成長率是十．四七％，是近十幾年來最高，但根本就未達每年一．六％。我不期待馬英九...,<generator object <genexpr> at 0x11cdfb390>,Liberal Times
馬英九說謊大全 中國網友瘋狂中,https://news.ltn.com.tw/news/opinion/paper/544288,"◎ 許建榮
總統大選辯論登場，但我們只見馬英九全程以謊言攻擊對手。首先馬砲轟民進黨貪腐，但除扁案持續偵辦外，統媒和國民黨攻擊的「高鐵招標案」、「高捷弊案」、「巴紐案」、「高鐵減振案」、「安亞專案」等，...",<generator object <genexpr> at 0x11cdfb408>,Liberal Times
您用募兵制騙票嗎？,https://news.ltn.com.tw/news/opinion/paper/544287,"政策，以致另一個同樣受年輕選民關心的議題「募兵制」在此次辯論、甚至大選中消失。
募兵制是馬英九總統兩次競選的重要政見，《黃金十年》更是白紙黑字強調會推動募兵制。但馬英九政府的國防部長高華柱卻一...",<generator object <genexpr> at 0x11cdfb480>,Liberal Times
看總統唬弄BBC和TIME,https://news.ltn.com.tw/news/opinion/paper/544286,，藍綠雙方以打口水戰的方式做為選舉主軸，令人遺憾，且問雙英該如何「看待這樣的選舉文化」時，馬英九說，他不是在打口水戰、而是在進行「澄清」。令人納悶的是，馬英九既然這麼在意「澄清」這檔子事，為什麼...,<generator object <genexpr> at 0x11cdfb4f8>,Liberal Times
雙英政見 居住正義法案恐跳票,https://news.ltn.com.tw/news/politics/paper/544274,"燕玲、顏若瑾／台北報導〕因應大選到來，立法院將在十二月十四日停會，但被國、民兩黨總統候選人馬英九、蔡英文列為競選政見的實價登錄三法及住宅法草案，近日傳出因遭建商強力運作，導致此案面臨「跳票危機」！
距...",<generator object <genexpr> at 0x11cdfb570>,Liberal Times
立院停會在即／綠委批藍只顧選票 不理民生法案,https://news.ltn.com.tw/news/politics/paper/544273,說一套卻做一套，能在國會擁有四分之三的絕對多數，卻濫用權力，只挑有利的法案通過。能實現總統馬英九「黨產歸零」承諾的陽光法案「政黨法」，卻直接被抽掉；農基法從二○○八年三月送到立法院之後，至今沒有任何進度...,<generator object <genexpr> at 0x11cdfb5e8>,Liberal Times
ECFA簽一年半 綠轟FTA沒個影,https://news.ltn.com.tw/news/politics/paper/544272,〔記者黃維助／台北報導〕總統馬英九過去宣傳ＥＣＦＡ的效益，指稱簽署ＥＣＦＡ後，以往擔心中國壓力的國家會敢與我方洽簽自由貿易協定（ＦＴＡ）。但兩岸簽署ＥＣＦＡ已近一年半，台灣雖欲與美國等主要貿易國家簽署Ｆ...,<generator object <genexpr> at 0x11cdfb660>,Liberal Times
林瑞雄 跟對手辯「仁」心,https://news.ltn.com.tw/news/politics/paper/544270,林瑞雄說，藍綠都執政過，但卻讓台灣經濟空轉，倒退至十三年前，人民都給藍綠兩黨機會了，尤其是馬英九總統，三年多前當選意氣風發，宣稱「完全執政，完全負責」，「現在呢？」他呼籲大眾眼睛要張開，只有宋楚瑜可以解...,<generator object <genexpr> at 0x11cdfb6d8>,Liberal Times
蘇嘉全 模擬尊林打吳,https://news.ltn.com.tw/news/politics/paper/544269,引發農舍爭議、基金會事件和祖墳事件，將是蘇嘉全防守重點，雖然蘇嘉全已宣布將農舍捐出，不過，馬英九總統前天在辯論會上仍質疑此事，幕僚表示，對於相關爭議都會做模擬演練。...,<generator object <genexpr> at 0x11cdfb750>,Liberal Times
民團失望：淪政治口水戰,https://news.ltn.com.tw/news/politics/paper/544266,"不對，該案應該交給檢調單位處理，而不是拿出來辯論。
「我要好總統公民連線」召開記者會，對馬英九、蔡英文、宋楚瑜等三位候選人在辯論會上的表現，提出觀察與評論。
簡錫堦指出，看不出三組候選人對於居住正義...",<generator object <genexpr> at 0x11cecb750>,Liberal Times
評大選首場辯論會／董立文：92共識成馬撕裂台灣工具,https://news.ltn.com.tw/news/politics/paper/544265,〔記者陳慧萍／台北報導〕總統馬英九在首場總統大選電視辯論會上公開叫陣，質問民進黨總統候選人蔡英文「敢不敢講不獨？」台灣智庫諮詢委員董立文昨指出，這是馬在這場辯論所犯最大錯誤，統獨在台灣各有支持者，馬可以...,<generator object <genexpr> at 0x11cecb7c8>,Liberal Times
蘇嘉全：雙北輸的 南屏贏回來,https://news.ltn.com.tw/news/politics/paper/544263,"屬猴的蘇嘉全，期望他與蔡英文能當選。蘇嘉全興奮地表示，和蔡英文都屬猴，加上獼猴爺爺，屬虎的馬英九將「猛虎難敵猴群」，一定會被打敗。
蘇嘉全另到彰化市為黨籍立委候選人黃秀芳助選時表示，馬英九四年...",<generator object <genexpr> at 0x11cecb840>,Liberal Times
教部12年國教說明會 遭質疑替馬吳輔選,https://news.ltn.com.tw/news/politics/paper/544262,合報導〕教育部四日舉辦中區退休教育人員十二年國教說明會，國民黨副總統候選人吳敦義出席時宣傳馬英九的教育政績，教育部長吳清基則在會後餐會時感謝總統馬英九和閣揆吳敦義對教育部的支持。民進黨總統候選人...,<generator object <genexpr> at 0x11cecb8b8>,Liberal Times
過去式總統VS.準總統,https://news.ltn.com.tw/news/opinion/paper/544234,"一名」！
三位總統候選人大戰、三個政黨惡戰、媒體也參戰，混戰濃濃硝煙中，仍依稀可見輪廓，馬英九主打「過去式」，蔡英文訴求「未來式」，宋楚瑜把握「現在式」。
馬英九開始就猛攻「陳水扁」及「前朝...",<generator object <genexpr> at 0x11cecb930>,Liberal Times
花博來彰化 蘇嘉全︰10趴經費就夠,https://news.ltn.com.tw/news/local/paper/544201,"強硬。
昨天下午，謝長廷先後到福興鄉及和美鎮為第一選區立委候選人陳進丁站台，他一再強調，馬英九一再跳票，該換黨換人，而立委是總統的後盾，挺小英就要選陳進丁，而第一選區是民進黨最有機會的選區，從這裡向東...",<generator object <genexpr> at 0x11cecb9a8>,Liberal Times
抗議動物收容所亂象 一度爆發推擠,https://news.ltn.com.tw/news/life/paper/544150,"終結動物收容所的亂象，藝人隋棠也現身聲援。動保團體透露，農委會阻撓昨天抗議活動，以不惜取消馬英九總統承諾召開的動保會議做威脅，不過，農委會否認。
由高雄市關懷流浪動物協會、台南市流浪動物研究會與貓狗人...",<generator object <genexpr> at 0x11cecba20>,Liberal Times
綠推「希望天空」　揪民眾10日凱道打卡許願,https://news.ltn.com.tw/news/politics/breakingnews/575846,"統府的天空打卡、許願。

　另外，蔡英文今日下午出席同濟會全國後援會成立大會，再批總統馬英九只會罵在野黨，卻不會替國家想，她說，政績不是靠罵在野黨撐起來的，而是要想如何改進制度和政策，給國家一個長遠...",<generator object <genexpr> at 0x11cecba98>,Liberal Times
槍擊案後首同台　馬、連解心結？,https://news.ltn.com.tw/news/politics/breakingnews/575838,〔即時新聞／綜合報導〕總統馬英九今(4)日參加國民黨立委丁守中舉辦的演唱會，前悠遊卡董座連勝文也出席站台，這也是繼去年連勝文遭槍擊案件發生後，馬英九和連勝文首度同台，連勝文大力聲援馬英九...,<generator object <genexpr> at 0x11cecbb10>,Liberal Times
面對副手辯論　林瑞雄：巧言令色鮮矣仁,https://news.ltn.com.tw/news/politics/breakingnews/575837,林瑞雄說，藍綠都執政過，卻是讓台灣經濟空轉，倒退至十三年前，人民都給藍綠兩黨機會了，尤其是馬英九總統，三年前當選時宣稱「完全執政，完全負責」，但「現在呢？」林瑞雄說，大家的眼睛都很雪亮。...,<generator object <genexpr> at 0x11cecbb88>,Liberal Times
總統大選》「馬」少了「扁」　謝長廷嗆：沒得騙,https://news.ltn.com.tw/news/politics/breakingnews/575798,"出「馬」加「扁」等於「騙」，現在沒有「扁」，可能也比較難「騙」。

　謝長廷說，4年前馬英九狂打陳水扁議題，「馬」加「扁」等於「騙」，藉此騙了一堆選票，4年後還非要跟「扁」綁在一起，現在已經無法再打...",<generator object <genexpr> at 0x11cecbc00>,Liberal Times
北部立委》羅淑蕾橘骨藍皮？　馬英九、蔣孝嚴消毒,https://news.ltn.com.tw/news/politics/breakingnews/575730,"北松山）選區立委候選人羅淑蕾今天成立全國會計師界、松山軍榮眷力挺馬吳配與她的後援總會，總統馬英九等人站台時，不約而同地消毒選民對她「橘骨藍皮」的疑慮，彌合她與副主席、立委蔣孝嚴的初選傷痕。

　羅淑...",<generator object <genexpr> at 0x11cecbc78>,Liberal Times
總統大選》小英籲不要只會罵人、背數字的總統,https://news.ltn.com.tw/news/politics/breakingnews/575725,記者李容萍／桃園報導〕民進黨總統候選人蔡英文桃園選戰指揮中心，今天近午成立，蔡英文批評對手馬英九選舉選到現在，是越來越會罵人，而且越像現在執政準備在野那一種，只會罵人、只會背數字，她有信心桃園選的好、選...,<generator object <genexpr> at 0x11cecbcf0>,Liberal Times
今日各報重點新聞一覽,https://news.ltn.com.tw/news/politics/breakingnews/575637,12年總統大選首場電視辯論會昨天登場，3位總統候選人從內政議題到兩岸政策全面交鋒，國民黨的馬英九和民進黨的蔡英文更在「92共識」和「台灣共識」上針鋒相對。親民黨的宋楚瑜則自闢戰場，在雙英的火砲射程外，力...,<generator object <genexpr> at 0x11cecbd68>,Liberal Times
真正二打一,https://news.ltn.com.tw/news/opinion/paper/544139,"向、主體意識的堅持，比起滔滔不絕或是天花亂墜，重要多了；而執政者還多加一道施政成績的檢驗，馬英九必須受到更多的挑戰。
藍營許多幫閒者蔑視主權在民和直接民主的真諦，說這是場「二打一」的選舉，極力唱衰宋楚...",<generator object <genexpr> at 0x11cecbde0>,Liberal Times
《大選辯論╱花絮》陪馬辯論 周美青與08年「衣」樣,https://news.ltn.com.tw/news/focus/paper/544103,"〔記者王寓中、李欣芳、施曉光、彭顯鈞／台北報導〕總統大選辯論會昨在公視舉行，馬英九總統在夫人周美青陪同下，最早抵達會場。
 馬身穿深色西裝，搭配香檳底色的黑條紋領帶；周美青則穿著咖啡色細格紋外套，黑色...",<generator object <genexpr> at 0x11cf9f8b8>,Liberal Times
《大選辯論╱會後記者會》雙英火線交鋒 宋成了公道伯,https://news.ltn.com.tw/news/focus/paper/544102,"」，為自己背書，這時宋楚瑜又像經過兩個吵架者的路人，硬被拉來當「公道伯」，尤其交互詰問時，馬英九的質問完全衝著蔡英文而來，讓宋楚瑜在回答時忍不住笑稱，「剛才的問題，好像不是在問我。」
無論申論、結論，...",<generator object <genexpr> at 0x11cf9f930>,Liberal Times
《大選辯論╱會後記者會》宋：肯定雙英表現 自己已盡力,https://news.ltn.com.tw/news/focus/paper/544101,"〕昨天辯論會結束後，面對媒體要求評論自己與對手的表現，親民黨總統候選人宋楚瑜表示，他要給予馬英九、蔡英文「很高的評價」；至於他自己，則是已經盡了最大努力。
不噴口水 定位國家政策討論
宋楚瑜表示，在...",<generator object <genexpr> at 0x11cf9f9a8>,Liberal Times
《大選辯論╱會後記者會》蔡馬角色易位 小英穩中帶攻,https://news.ltn.com.tw/news/focus/paper/544100,ＦＡ辯論時使用民眾較難懂的學術語言，總統大選首場辯論，蔡英文頗有條理申論政見並適時反擊對手馬英九，其辯論技巧已有進步。不過，還在適應鎂光燈的小英，臉上表情仍略顯緊張，未來加強模擬練習，應可使肢體表現更為...,<generator object <genexpr> at 0x11cf9fa20>,Liberal Times
